row_id,pid,question,comment_clean,out_misrep,out_emo_lang,out_ideo_extrem,out_slip_slope,out_insult,out_mock_sarc,out_threat,pa_dress,pa_appear,pa_attit,pa_interact,pa_humor,pa_other,pb_sex,pb_lgbtq,pb_race,pb_origin,pb_nuero_div,pb_phys_able,pb_pol_affil,complex,constructive,reflective
737,18828202,weaknesses,"My only dislike of the course is the timing. The last part of the course is all about Excel and while necessary, it might be better if Excel was the second unit. The current second unit is Quickbooks. I enjoyed this section, but I think it should be moved to the last unit. Excel requires an immense amount of time and I think it would be better if it were moved to the middle of the semester where our workloads aren't as heavy. For athletes and extremely busy people, these past few weeks have been challenging. Our workloads might be lighter if we had a Quickbooks as the unit to end instead of Excel.",0,0,0,0,0,0,0,0,0,0,0,0,0,0,0,0,0,0,0,0,0,1,0
1397,14474144,strengths,This course helped us to learn how to find information for ourselves instead of always relying on it to be given to us.,0,0,0,0,0,0,0,0,0,0,0,0,0,0,0,0,0,0,0,0,0,0,0
1707,22435929,improved,"Devote more time to learning things like CAD, Onshape, and Excel (with learning more features of Excel). Do walk through tutorials in class with the Arduino kits instead of giving them to us a with a PDF of how to use parts of it.",0,0,0,0,0,0,0,0,0,0,0,0,0,0,0,0,0,0,0,0,0,0,0
1656,41233812,weaknesses,although i liked the figure it out yourself sometimes it was hard to grasp a specific concept in time before taking the tests at the end of the week in addition i think there was slightly more material then we can cover in this course from the weekly ICAs to the tests at the end of the week and over arching nacb project it doesn't seem like a lot but it stacks up quick and can lead to lots of negligence on some items when trying to take care of others especially when struggling on 1 or more of the items for the week.,0,0,0,0,0,0,0,0,0,0,0,0,0,0,0,0,0,0,0,0,0,0,0
254,37739386,weaknesses,"Weaknesses were that not all PowerPoints were posted to Moodle, only a few of them were. Also, there was no real divide in content, you never really knew what material was a part of what.",0,0,0,0,0,0,0,0,0,0,0,0,0,0,0,0,0,0,0,0,0,0,0
1501,41099391,weaknesses,"The TA's and teachers' advice and feedback were not aligned - trying to get help from them sometimes led to me just being even more confused and the assignment being even more messed up than before getting help. Sometimes the assignments included unnecessary busy work - for example, I felt like I did not really learn anything from the testing in M2b. The instructions for assignments need to be a little more clear - for example, I was really confused in M1 because I thought we would be focusing on building the structures rather than just creating a site plan. I think it would be helpful to provide examples of the deliverables of the projects, so students understand better understand what they have to complete.",0,0,0,0,0,0,0,0,0,0,0,0,0,0,0,0,0,0,0,0,0,0,0
549,70466384,weaknesses,None really I can think of,0,0,0,0,0,0,0,0,0,0,0,0,0,0,0,0,0,0,0,0,0,0,0
56,95315883,improved,Get a new professor. Pay Jarrod more money.,0,0,0,0,0,0,0,0,0,0,0,0,0,0,0,0,0,0,0,0,0,0,0
1290,12434303,improved,"This course could be improved by making sure quizzes open up at the end of course, having structors take at least 50 minutes so it doesn't feel pointless to come, changing the total point total to be larger than 100, and making the final not as impactful on students grades especially when they have not taken an exam all year.",0,0,0,0,0,0,0,0,0,0,0,0,0,0,0,0,0,0,0,0,0,0,0
1518,89652528,weaknesses,Some of the weaknesses were the homeworkÂ’s being a little complicated. The methods of teaching were fine.Â,0,0,0,0,0,0,0,0,0,0,0,0,0,0,0,0,0,0,0,0,0,0,0
1567,67626179,weaknesses,The deadlines of the experiment and project overlapping at times added to a lot of the stress of the course. As well as the bulk of the project (data collection and report writing) being left to dead week and the week before.,0,0,0,0,0,0,0,0,0,0,0,0,0,0,0,0,0,0,0,0,0,0,0
225,71100179,weaknesses,"Seek You was a difficult book to read about follow a with because of the pictures. The participation grading is somewhat unfair because at the beginning of the class, students were told if they spoke every class or every other class then they would get these points. Some people were getting perfect scores when they did not even participate in class. There is alot of writing in the class, and although these are the exams, I understand the length of writing. With the writing, it was hard to find the will to respond to some of them when they were not of topic we suggested.",0,0,0,0,0,0,0,0,0,0,0,0,0,0,0,0,0,0,0,0,0,0,0
373,52146560,strengths,"Great attention grabber, I was nervous about the class being very boring and exhausting but the lectures were very enjoyable to listen too and made me think in ways I haven't before.",0,0,0,0,0,0,0,0,0,0,0,0,0,0,0,0,0,0,0,0,0,0,0
930,26492712,weaknesses,"Felt disorganized. I disliked the lack of teaching on certain mechanical concepts prior to having to work on a very ambitious project. It made pursuing a final design difficult. Felt that, unironically, the course didn't tie things together within the design process. It didn't feel like there was any clear application stated to the parts of the design process.",0,0,0,0,0,0,0,0,0,0,0,0,0,0,0,0,0,0,0,0,0,0,0
144,62543532,strengths,I enjoyed the enthusiasm that came with the lectures so I did not get bored as often.Â,0,0,0,0,0,0,0,0,0,0,0,0,0,0,0,0,0,0,0,0,0,0,0
1750,92775077,improved,Move or get rid of the last experiment so that students can work on the group project better.,0,0,0,0,0,0,0,0,0,0,0,0,0,0,0,0,0,0,0,0,0,0,0
1801,93723087,improved,Less CAD. Besides that I don't have anything,0,0,0,0,0,0,0,0,0,0,0,0,0,0,0,0,0,0,0,0,0,0,0
235,94184295,weaknesses,Maybe incorporate a bit of homework to help balance out the grade if one of the papers was failed,0,0,0,0,0,0,0,0,0,0,0,0,0,0,0,0,0,0,0,0,0,0,0
376,35337962,strengths,Fun conversations in class,0,0,0,0,0,0,0,0,0,0,0,0,0,0,0,0,0,0,0,0,0,0,0
1847,59458310,instructor,She really cares about her students and wants them to succeed!,0,0,0,0,0,0,0,0,0,0,0,0,0,0,0,0,0,0,0,0,0,0,0
649,93424523,improved,"Group lab times need to be more structured in my opinion, setting us loose with minimal guidance and simply saying 'that's not what I'm looking for' when asked did not help me learn the material, it just made me anxious about the poor grade I knew I would received because of my lack of understanding.",0,0,0,0,0,0,0,0,0,0,0,0,0,0,0,0,0,0,0,0,0,1,0
186,87059474,weaknesses,None that I can think of,0,0,0,0,0,0,0,0,0,0,0,0,0,0,0,0,0,0,0,0,0,0,0
1474,70597469,strengths,I feel like a strength of the course is how self paced it was.,0,0,0,0,0,0,0,0,0,0,0,0,0,0,0,0,0,0,0,0,0,0,0
1608,83489024,weaknesses,I didn't like the classroom this course was held in. it was hard to have one be the focal point in a classroom like that.,0,0,0,0,0,0,0,0,0,0,0,0,0,0,0,0,0,0,0,0,0,0,0
1664,60906719,weaknesses,"There was a huge lack of accountability for this class which caused me to fall behind. I thought I was ahead of schedule but later found out I was not pacing for the grade I wanted. The Â“due datesÂ” were hard to locate. Also, I cant read Dr s hand writing for the life of me.",0,0,0,0,0,0,0,0,0,0,0,0,0,0,0,0,0,0,0,0,0,0,0
210,43681259,weaknesses,"Way too much homework, an unhealthy amount that drove students away from the topic and lost their interest. Homework due everyday and made this class the top class over others because of the demand of work even though it is an elective.",0,0,0,0,0,0,0,0,0,0,0,0,0,0,0,0,0,0,0,0,0,0,0
869,95247757,strengths,I liked the exposure to the lab equipment used for thermodynamics and heat transfer experiments.,0,0,0,0,0,0,0,0,0,0,0,0,0,0,0,0,0,0,0,0,0,0,0
945,38991232,weaknesses,"The weaknesses are that since we have to work with the same people, we do get annoyed with them at times, and some people seem to grow very lactual and become on their own schedule when everyone agrees to be there by a certain time for group meetings and things like that, or to get things done on time. Other than that, I like how set in stone and scheduled the course is.",0,0,0,0,0,0,0,0,0,0,0,0,0,0,0,0,0,0,0,0,0,0,0
956,70160805,weaknesses,The weaknesses of the course were minimal but while I enjoyed working in groups some people did not put in their effort and it showed. While you cannot do much about this in my eyes it is the only weakness there.,0,0,0,0,0,0,0,0,0,0,0,0,0,0,0,0,0,0,0,0,0,0,0
282,73983612,improved,i dont know actually maybe a movie day,0,0,0,0,0,0,0,0,0,0,0,0,0,0,0,0,0,0,0,0,0,0,0
315,16705344,improved,"the assignments are set up to be discussed, so the class should be set up in groups for discussion about certain topics to come to the conclusions he wants rather than being lectured on. he needs to keep his opinions to himself and let students discuss to learn. change the paper topic every time and discuss in class after grading what you're looking for. teach topics/ points you want included in papers in class rather than talking about supporting examples and not connecting them. connect to modern day topics, not old history or religion that is difficult for students to connect to. this class is well set up, but should be taught by a different professor",0,0,0,0,0,0,0,0,0,0,0,0,0,0,0,0,0,0,0,0,0,0,0
1540,67819659,weaknesses,"I think a weakness of the course was the off-putting nature of having several term goals going on at the same time that were presented as major contributors to the class. Having the design projects, the OME, the homework, and then just general classwork while I think effective and probably and good preparatory method for actual work I think they should be more integrated with each other. They shouldn't work entirely separate from each other or at least not be presented that way as it is a drain upon students motivation seeing all that they have to do at the same time. Although I do think the course work itself is good for the actual assignments themselves though. I do think that individual topics were a bit too individual and separated from each other.",0,0,0,0,0,0,0,0,0,0,0,0,0,0,0,0,0,0,0,0,0,0,0
299,47479312,improved,"I can think of zero ways to improve the class, it is one of my favorites this semester and I feel most people would enjoy it if they looked beyond the fact that makes the class almost impossible to fail.",0,0,0,0,0,0,0,0,0,0,0,0,0,0,0,0,0,0,0,0,0,0,0
669,67117873,improved,I honestly have no complaints,0,0,0,0,0,0,0,0,0,0,0,0,0,0,0,0,0,0,0,0,0,0,0
988,35142039,weaknesses,have better notes where i could have the notes completed before class so i can effectivly follow a with you in class with the notes.,0,0,0,0,0,0,0,0,0,0,0,0,0,0,0,0,0,0,0,0,0,0,0
502,15629662,weaknesses,I didn't like how most of the topics covered did not relate to my major because it was harder to think about what was right.,0,0,0,0,0,0,0,0,0,0,0,0,0,0,0,0,0,0,0,0,0,0,0
622,75092674,improved,doing more activities,0,0,0,0,0,0,0,0,0,0,0,0,0,0,0,0,0,0,0,0,0,0,0
1467,53135357,strengths,taught me how to use software that I will be using in classes that I will be taking,0,0,0,0,0,0,0,0,0,0,0,0,0,0,0,0,0,0,0,0,0,0,0
1662,96962619,weaknesses,"The margin for error on the quizzes was sometimes extremely small, where a minor mistake could sometimes be enough for a failure rather than a contingency.",0,0,0,0,0,0,0,0,0,0,0,0,0,0,0,0,0,0,0,0,0,0,0
619,52909459,improved,"Change the language used and describe the correct format of writing. even give us a example from previous years that have been graded for bad, good and excellent work.",0,0,0,0,0,0,0,0,0,0,0,0,0,0,0,0,0,0,0,0,0,0,0
628,62908814,improved,Do not make this course required.,0,0,0,0,0,0,0,0,0,0,0,0,0,0,0,0,0,0,0,0,0,0,0
961,46283684,weaknesses,"In group work, sometimes there are a few individuals who do not do their part so it puts more stress on the rest of us to make up for their loss of presence.",0,0,0,0,0,0,0,0,0,0,0,0,0,0,0,0,0,0,0,0,0,0,0
255,31042594,weaknesses,The weakness of this course was that we did not always have access to the slides.,0,0,0,0,0,0,0,0,0,0,0,0,0,0,0,0,0,0,0,0,0,0,0
816,23000104,strengths,the power points were helpful,0,0,0,0,0,0,0,0,0,0,0,0,0,0,0,0,0,0,0,0,0,0,0
1248,49680118,improved,I do not have any ideas except I like a movie called _limitless_ and I think it could apply to this course well.,0,0,0,0,0,0,0,0,0,0,0,0,0,0,0,0,0,0,0,0,0,0,0
1614,73946762,weaknesses,The course reading did not provide me with much of anything.,0,0,0,0,0,0,0,0,0,0,0,0,0,0,0,0,0,0,0,0,0,0,0
1623,77385348,weaknesses,The power points at times were very lengthy and hard to stay engaged in. I disliked that there were not many things to look back on for the content exam.,0,0,0,0,0,0,0,0,0,0,0,0,0,0,0,0,0,0,0,0,0,0,0
598,15705797,weaknesses,"I didn't realize when I signed up for it that this was an aesthetic credit and not an English credit. I didn't care much to discuss directors' choices such as lighting, camera angle, etc.",0,0,0,0,0,0,0,0,0,0,0,0,0,0,0,0,0,0,0,0,0,0,0
1935,45538869,improved,"Like most professors, he sometimes asks open-ended questions that rely on inferences or outside knowledge and you sort of have to read his mind. I think its an attempt to get us to think critically, which is a fair teaching tool, but I think its okay for some of these questions to be rhetorical and for him to explain, especially because when you ask questions like _why would they structure their company this way? what is the benefit,_ there's so many answers, and also different levels of specificity he could be looking for, and its easy to get discouraged because the answer you thought was right wasn't close enough, or other people's answers went in a different direction than you were thinking. Like, the answers could have to do with civil liability, federal taxes, management ease, or be an answer as general as _for the money,_ and I don't know that there's a good way to indicate what exactly you're looking for when you ask those kinds of broad questions.",0,0,0,0,0,0,0,0,0,0,0,0,0,0,0,0,0,0,0,0,0,0,0
1074,46056407,improved,No suggestions,0,0,0,0,0,0,0,0,0,0,0,0,0,0,0,0,0,0,0,0,0,0,0
1755,20757780,improved,No suggestions,0,0,0,0,0,0,0,0,0,0,0,0,0,0,0,0,0,0,0,0,0,0,0
486,34201850,weaknesses,"I wish I had known to get all of the points on the ATI modules that you had to get a 100% on the post test to get the full point on each of the modules. Although I missed less than 2 points in the 20 overall, I wish I had realized that earlier. It was in the syllabus which I found out mid way through the semester so technically it was my fault. I also really did not like the lab quizzes. I was used to being able to work in pairs on lab quizzes in physical assessment, and this semester I was very anxious when we had a quiz in lab because they were difficult for me. I also wish we got points for passing our lab check offs. At the end of the semester, I am going to be a few points away from an A in the course and having small points such as lab points would have helped me get an A in the course, after missing points elsewhere such as on lab quizzes.",0,0,0,0,0,0,0,0,0,0,0,0,0,0,0,0,0,0,0,0,0,0,0
1057,78939368,improved,"If we had more projects and hands on things, not big project but things that take up half the class that get your mind moving.",0,0,0,0,0,0,0,0,0,0,0,0,0,0,0,0,0,0,0,0,0,0,0
1202,61736191,weaknesses,"ONU struggles with sharing information to students about job opportunities/residencies. I am not saying they do not provide opportunities to meet but they provide no guidance to PHORcas, submitting transcripts (the instructions were missing VERY crucial information). I think this can fixed by having P6s talk to the P5s when we are coming back to boot camp. A simple breakout session to those who want to help would help the next class immensely. Lastly, I feel the relationship between the experiential office and the P6 classes needs to drastically improve. Consistent threats of grade dropping, failing rotations, and an overall adversarial relationship does not build a productive relationship/build prepared pharmacists. Students are scared in the first place for these rotations and ONU consistently threatening to drop grades or fail rotations does not help anyone. My suggestion is to have these conversations on a al level. I am not saying to have a one on one session with every student but those who are struggling might need help.",0,0,0,0,0,0,0,0,0,0,0,0,0,0,0,0,0,0,0,0,1,1,0
1208,10985004,weaknesses,"ONU struggles with sharing information to students about job opportunities/residencies. I am not saying they do not provide opportunities to meet but they provide no guidance to PHORcas, submitting transcripts (the instructions were missing VERY crucial information). I think this can fixed by having P6s talk to the P5s when we are coming back to boot camp. A simple breakout session to those who want to help would help the next class immensely. Lastly, I feel the relationship between the experiential office and the P6 classes needs to drastically improve. Consistent threats of grade dropping, failing rotations, and an overall adversarial relationship does not build a productive relationship/build prepared pharmacists. Students are scared in the first place for these rotations and ONU consistently threatening to drop grades or fail rotations does not help anyone. My suggestion is to have these conversations on a al level. I am not saying to have a one on one session with every student but those who are struggling might need help.",0,0,0,0,0,0,0,0,0,0,0,0,0,0,0,0,0,0,0,0,0,0,0
1211,24496363,weaknesses,"ONU struggles with sharing information to students about job opportunities/residencies. I am not saying they do not provide opportunities to meet but they provide no guidance to PHORcas, submitting transcripts (the instructions were missing VERY crucial information). I think this can fixed by having P6s talk to the P5s when we are coming back to boot camp. A simple breakout session to those who want to help would help the next class immensely. Lastly, I feel the relationship between the experiential office and the P6 classes needs to drastically improve. Consistent threats of grade dropping, failing rotations, and an overall adversarial relationship does not build a productive relationship/build prepared pharmacists. Students are scared in the first place for these rotations and ONU consistently threatening to drop grades or fail rotations does not help anyone. My suggestion is to have these conversations on a al level. I am not saying to have a one on one session with every student but those who are struggling might need help.",0,0,0,0,0,0,0,0,0,0,0,0,0,0,0,0,0,0,0,0,0,0,0
1157,86063603,improved,"Please get rid of the exams, they didn't have anything to do with the actual labs and were more about trying to remember material from Fluid Mechanics and Thermo. If there are exams make it more about the lab or equipment forcing us to remember how to use the equipment. I understand the calculations are fundamental, but we are already tested and taught that in our other classes including Heat Transfer the one we are taking currently when taking this lab. Also don't require full-on reports or at least reduce the amount of reports needed to be written. Overall there are a lot of things in this class that we have already learned and been tested on in other classes, and this class should really just focus on the equipment. I also would suggest having sophomores or even freshmen take this course, so that they know how to use this equipment for future projects and they get excited about using it. Taking it in the Spring Semester of Junior year seems kind of a waste because we just learned how to use the equipment but won't be able to use any of it since we are about to start capstone and graduate.",0,0,0,0,0,0,0,0,0,0,0,0,0,0,0,0,0,0,0,0,0,0,0
1939,90220903,strengths,I liked hearing speakers a the end of the semester.,0,0,0,0,0,0,0,0,0,0,0,0,0,0,0,0,0,0,0,0,0,0,0
1620,42137895,weaknesses,"A weakness of this course is the workload. The workload is not bad if you have good groups for your milestone projects, however if you have a milestone group that will not do a lot of work then the workload can be very heavy. I understand that the point of this course is to improve our teamwork skills and ability to work under stress, but when your teammates will not do any work, it hurts you immensely.",0,0,0,0,0,0,0,0,0,0,0,0,0,0,0,0,0,0,0,0,0,0,0
1653,28512132,weaknesses,Not much structure made learning hard. I did not like that I had to plan the entire semester and keep up with myself. No one was at the same point in the course at the same time for the most part which made it hard. I did not like the teaching method that was used. I was not a fan of the method of here is everything for the year learn it on your own. I think the professor could have given more detail and information to make the homework and projects easier for us. I also never felt like I had a good understanding on how to use MATLAB and I was always googling how to work it when I could get the explanation for the professor.,0,0,0,0,0,0,0,0,0,0,0,0,0,0,0,0,0,0,0,0,1,1,0
1941,23808713,weaknesses,The class seems to focus on some irrelevant information (example: the history of pharmacy in the last 2000+ years). I preferred small groups 100%.,0,0,0,0,0,0,0,0,0,0,0,0,0,0,0,0,0,0,0,0,0,0,0
933,55902017,weaknesses,The homework in this class were graded very hard.,0,0,0,0,0,0,0,0,0,0,0,0,0,0,0,0,0,0,0,0,0,0,0
1769,15381587,improved,The instructor should try and outsource some of his work. It seemed at times he had too much on his plate and was slow in getting necessary information out.,0,0,0,0,0,0,0,0,0,0,0,0,0,0,0,0,0,0,0,0,0,0,0
195,96269276,weaknesses,"One of the weaknesses I found was the smaller individual groups. Often the small group conversations didnÂ’t go far and there was very little variation in groups, leading to the same 4 or 5 people discussing every scenario or a particular viewpoint.",0,0,0,0,0,0,0,0,0,0,0,0,0,0,0,0,0,0,0,0,0,0,0
947,71197120,weaknesses,Some of the assignment descriptions were not very clear and lead to a lot of confusion between groups.,0,0,0,0,0,0,0,0,0,0,0,0,0,0,0,0,0,0,0,0,0,0,0
731,67493746,weaknesses,I can't think of any weaknesses in the course.,0,0,0,0,0,0,0,0,0,0,0,0,0,0,0,0,0,0,0,0,0,0,0
148,70166589,strengths,The only thing that was remotely okay about the course was the concert observation form. It was very clear what was wanted and he didn't take off unnecessary points.,0,0,0,0,0,0,0,0,0,0,0,0,0,0,0,0,0,0,0,0,0,0,0
1509,40205397,weaknesses,"I found this course to be incredibly random, the assignments felt like they were overdrawing the topic they presented. Assignments also took upwards of 8 hours to get done. I found that the slides used in class did not help very much.",0,0,0,0,0,0,0,0,0,0,0,0,0,0,0,0,0,0,0,0,0,0,0
241,79804178,weaknesses,I think some lectures got tedious; we could've accomplished more if we got straight to the point in how to write certain sections of our paper.,0,0,0,0,0,0,0,0,0,0,0,0,0,0,0,0,0,0,0,0,0,0,0
707,92133417,improved,Keeping on track and covering all topics. We often had to teach ourselves much of the material because he did not have time to cover it. Most of lecture was random rambling.,0,0,0,0,0,0,0,0,0,0,0,0,0,0,0,0,0,0,0,0,0,0,0
932,51279293,weaknesses,No weaknesses.,0,0,0,0,0,0,0,0,0,0,0,0,0,0,0,0,0,0,0,0,0,0,0
170,44854709,weaknesses,It was sometimes unclear what we should specifically study and understand for exams.Â,0,0,0,0,0,0,0,0,0,0,0,0,0,0,0,0,0,0,0,0,0,0,0
960,29195743,weaknesses,A weakness of this course is that some of the lectures and content discussed in the course did not really apply to our design project and I feel that this makes me less likely to remember this content in the future.,0,0,0,0,0,0,0,0,0,0,0,0,0,0,0,0,0,0,0,0,0,0,0
1140,64460575,improved,Root Locus and Bode Plots are by far the hardest thing we do in DS2 so some more time spent on those would be super beneficial.,0,0,0,0,0,0,0,0,0,0,0,0,0,0,0,0,0,0,0,0,0,0,0
1295,55145802,improved,I almost wish we had a midterm exam so that we were forced to learn all of the information before the final.,0,0,0,0,0,0,0,0,0,0,0,0,0,0,0,0,0,0,0,0,0,0,0
1515,81201244,weaknesses,Time conflicts,0,0,0,0,0,0,0,0,0,0,0,0,0,0,0,0,0,0,0,0,0,0,0
498,12648054,weaknesses,he just went over homeworks that we did and nothing else,0,0,0,0,0,0,0,0,0,0,0,0,0,0,0,0,0,0,0,0,0,0,0
928,33773055,weaknesses,Most instructions for assignments are not very clear.,0,0,0,0,0,0,0,0,0,0,0,0,0,0,0,0,0,0,0,0,0,0,0
1004,22065616,weaknesses,I feel like sometimes it was hard to get caught back up if you missed a class or were confused on the material.,0,0,0,0,0,0,0,0,0,0,0,0,0,0,0,0,0,0,0,0,0,0,0
1912,78516583,weaknesses,"Professor Bales seemed unorganized and unprepared at times. We also had a multitude of guest speakers this semester - some effective and some not. As a result, we didn't end up covering all the material that was intended to be covered.",0,0,0,0,0,0,0,0,0,0,0,0,0,0,0,0,0,0,0,0,0,0,0
426,80347839,strengths,I liked the slides that we went through and the discussions that stemmed from the slide. Specifically the discussions on social experiments done in the U.S.,0,0,0,0,0,0,0,0,0,0,0,0,0,0,0,0,0,0,0,0,0,0,0
44,90895403,strengths,I liked how the powerpoints were given to us in full so that way we could catch up if we missed anything and the pacing felt okay,0,0,0,0,0,0,0,0,0,0,0,0,0,0,0,0,0,0,0,0,0,0,0
87,54118389,strengths,"easy class for the most part, lots of padding grades with homework",0,0,0,0,0,0,0,0,0,0,0,0,0,0,0,0,0,0,0,0,0,0,0
