row_id,pid,question,comment_clean,out_misrep,out_emo_lang,out_ideo_extrem,out_slip_slope,out_insult,out_mock_sarc,out_threat,pa_dress,pa_appear,pa_attit,pa_interact,pa_humor,pa_other,pb_sex,pb_lgbtq,pb_race,pb_origin,pb_nuero_div,pb_phys_able,pb_pol_affil,complex,constructive,reflective
602,77459094,improved,This class could be greatly improved by focusing more on application and workshopping. Being guided by the professor on how to apply the methods taught onto our papers would have been greatly helpful. Instead if someone struggled toapply the quantitative-heavy lectures they were only given feedback to work with. This feedback was often not very helpful due to its vagueness. This course could be greatly improved with more workshopping and looking at the larger ends of the thesis.,0,0,0,0,0,0,0,0,0,0,0,0,0,0,0,0,0,0,0,0,0,0,0
876,84819414,strengths,"I enjoyed getting to learn more about all the equipment in the labs. Some of them were fun to use, such as the turbojet and the thermal camera. Also the in class worksheets, although frustrating, ultimately were helpful practice with unit conversions and calculations.",0,0,0,0,0,0,0,0,0,0,0,0,0,0,0,0,0,0,0,0,0,0,0
1064,22950858,improved,Would like a more detailed was to see PE points,0,0,0,0,0,0,0,0,0,0,0,0,0,0,0,0,0,0,0,0,0,0,0
1314,88571330,strengths,The strengths were the notes and the hands-on instruction. I really enjoyed the labs. It was effective when he demonstrated physically what we were learning.,0,0,0,0,0,0,0,0,0,0,0,0,0,0,0,0,0,0,0,0,0,0,0
1373,81805168,strengths,"I like the combination of the in class lecturing being implemented into a hands on experiment lab, as sometimes classes just teach the material without always showing a hands on application. Dr. is also clearly very competent in the material he teaches and is very open to helping answer questions that take some more time to think about.Â",0,0,0,0,0,0,0,0,0,0,0,0,0,0,0,0,0,0,0,0,0,0,0
1482,50635054,strengths,The solid works portion was the most enjoyable and the best part of this course.,0,0,0,0,0,0,0,0,0,0,0,0,0,0,0,0,0,0,0,0,0,0,0
1909,77643669,weaknesses,"There was an over emphasis on speakers that in the majority did not really enhance my learning in the subject area. However, the speakers that came from a practice background were worthwhile contributors to the class to add in a practical aspect to the doctrinal course.",0,0,0,0,0,0,0,0,0,0,0,0,0,0,0,0,0,0,0,0,0,0,0
348,84613464,strengths,"Course was really interesting. I enjoyed the conference, i attended during the class. Giving examples during the class were interesting.",0,0,0,0,0,0,0,0,0,0,0,0,0,0,0,0,0,0,0,0,0,0,0
422,90855034,strengths,Video examples and the speech handouts were very helpful.,0,0,0,0,0,0,0,0,0,0,0,0,0,0,0,0,0,0,0,0,0,0,0
861,94523319,strengths,Felt like everything was explained well. Liked applying what was learned in class in the lab immediately. Helps a lot with the why should I care and how can I use this. I think concept quizzes or more concept questions on exams could go a way and help students in the run.,0,0,0,0,0,0,0,0,0,0,0,0,0,0,0,0,0,0,0,0,0,0,0
1096,51850971,improved,This course could be improved by connecting more of the material and content discussed in class to the design project. This would help show how this content relates to the real world and engineering as a whole.,0,0,0,0,0,0,0,0,0,0,0,0,0,0,0,0,0,0,0,0,0,0,0
112,71461159,strengths,I believe that this course was really good at connecting the readings that we had to activities that we did in class. These really helped demonstrate what the readings were trying to tell us.,0,0,0,0,0,0,0,0,0,0,0,0,0,0,0,0,0,0,0,0,0,0,0
115,92629281,strengths,this DO Good Project in this class was one of the best things that I could have done - I gathered some very important information on how to do a project of this scale and gained some more friends a the way.,0,0,0,0,0,0,0,0,0,0,0,0,0,0,0,0,0,0,0,0,0,0,0
1302,86710467,instructor,Dr Parker made law very interesting!,0,0,0,0,0,0,0,0,0,0,0,0,0,0,0,0,0,0,0,0,0,0,0
1739,23483319,improved,"The exams in this course feel somewhat out of place when there is a semester project and several experiments. It makes sense that the exams are to test what has been learned but don't the reports also show what has been learned in terms of experimentation? I felt like there should not have been a final exam and more emphasis on the project, or include more quizzes/tests so that we know what to expect on an exam.",0,0,0,0,0,0,0,0,0,0,0,0,0,0,0,0,0,0,0,0,0,0,0
623,14136329,improved,"More involvement and student-based learning, not lecture",0,0,0,0,0,0,0,0,0,0,0,0,0,0,0,0,0,0,0,0,0,0,0
655,17626024,improved,"Make days clear cut, give specific direction to students on days professor is off, more harsh guidelines on when stuff should be done, not just _should be done by this time_.",0,0,0,0,0,0,0,0,0,0,0,0,0,0,0,0,0,0,0,0,0,0,0
700,91058775,improved,"I preferred having all readings be electronic. I would sometimes forget to bring my book with me during the day, and would find it inconvenient that I couldn't just open up moodle to read it. I also felt that the CCC book was the least effective of the materials. I felt like the shorter stories achieved the same effect and drew less time outside of class for us.",0,0,0,0,0,0,0,0,0,0,0,0,0,0,0,0,0,0,0,0,0,0,0
858,81066149,strengths,"Lectures are very engaging, I love how able and down to earth Dr. is. Including solved versions of the homeworks after I have worked through the problems is extremely helpful in troubleshooting where I got stuck and verifies for me that I'm learning the content correctly. Getting hands on experience with the PLC's and motors really helped me better understand the concepts we were going through in class. Working together through problems in class is also super helpful.",0,0,0,0,0,0,0,0,0,0,0,0,0,0,0,0,0,0,0,0,0,0,0
1404,73797074,strengths,I liked that the reports built up in the amount of instruction given. I feel like it allowed for me to learn how to write a report more effectively than if we had had to write the entire report from the beginning.,0,0,0,0,0,0,0,0,0,0,0,0,0,0,0,0,0,0,0,0,0,0,0
1419,80817882,strengths,Course had a lot of variety and many group speakers.,0,0,0,0,0,0,0,0,0,0,0,0,0,0,0,0,0,0,0,0,0,0,0
464,75593295,strengths,The strength of this course was the professorÂ’s excitement to teach this class.,0,0,0,0,0,0,0,0,0,0,0,0,0,0,0,0,0,0,0,0,0,0,0
724,87856653,strengths,I liked how to websites we used went step by step. The workload was not too much for the amount of work that the class required. It was spread out pretty evenly.,0,0,0,0,0,0,0,0,0,0,0,0,0,0,0,0,0,0,0,0,0,0,0
848,21498446,strengths,"I enjoy how the class was designed in a way where everything we learned was important. I also felt that it was ok if we did not learn something right when it was first taught, which I really enjoyed.",0,0,0,0,0,0,0,0,0,0,0,0,0,0,0,0,0,0,0,0,0,0,0
1458,61140933,strengths,I liked learning about water treatment and wastewater treatment and then going on field trips. I believe this really helped me understand the material the best and it allowed me to get a visual for what I was learning about. I also like the labs that we completed like the different ways to treat water.,0,0,0,0,0,0,0,0,0,0,0,0,0,0,0,0,0,0,0,0,0,0,0
1689,26909463,improved,I believe that the class could use small quizzes throughout that are worth a small amount of the grade but check the students understanding of the topics.,0,0,0,0,0,0,0,0,0,0,0,0,0,0,0,0,0,0,0,0,0,0,0
393,39916608,strengths,"Good pacing, class was fast enough to remain interesting but not rushed. Good set up, curriculum flowed in an intuitive manner in terms of concept presentation.",0,0,0,0,0,0,0,0,0,0,0,0,0,0,0,0,0,0,0,0,0,0,0
395,21319237,strengths,"A study guide for the exams was almost necessary and very appreciated. I actually knew how to breakdown information and to what extent I needed to know the information due to the study guides. I enjoyed how Dr. would connect concepts to al stories, as they help in understanding the material. Some of the questions from the labs also helped in studying and preparing for exams. Extra credit opportunities are also very appreciated. When Dr. would point out specific pages from the reading it helped to figure out what exactly she wanted from the reading. Having a schedule to follow also made it very easy to understand what was due for the day.",0,0,0,0,0,0,0,0,0,0,0,0,0,0,0,0,0,0,0,0,0,0,0
458,66832734,strengths,I liked that Dr. would include media like videos to watch and readings to do that were not just what was being said on the powerpoint notes that were being presented to us.,0,0,0,0,0,0,0,0,0,0,0,0,0,0,0,0,0,0,0,0,0,0,0
66,46423751,strengths,Dr communicated many different forms of studying and preparing for this class which taught me how to effectively approach my classes in the future. Lectures were detailed and easy to understand.Â,0,0,0,0,0,0,0,0,0,0,0,0,0,0,0,0,0,0,0,0,0,0,0
718,73077636,improved,"By offering it every semester! If there were a part two to this course, I would take it! I love reading Shakespeare's plays, and I think that a lot of people find it too difficult or time consuming, but it just takes a little practice! Courses like this should be offered more and more in today's world, as it can teach us valuable lessons about relationships, ambition, and other such values. Dr. was the perfect to teach this class. She is often a tad on the theatrical side, and has quite the dramatic tone in her voice. As much as I loved this course, I can attribute most of it to the professor!",0,0,0,0,0,0,0,0,0,0,0,0,0,0,0,0,0,0,0,0,0,0,0
621,75655567,improved,Maybe dealing with more recent ethical issues and relying more on the opinions of the student than ethical figures.,0,0,0,0,0,0,0,0,0,0,0,0,0,0,0,0,0,0,0,0,0,0,0
1303,52860109,strengths,Taught me to stay on track and have a calender or spreadsheet available.,0,0,0,0,0,0,0,0,0,0,0,0,0,0,0,0,0,0,0,0,0,0,0
151,59889200,strengths,The strengths were the lectures with power points. I was able to be able to take notes from the presentation as well as take notes on what he was saying.,0,0,0,0,0,0,0,0,0,0,0,0,0,0,0,0,0,0,0,0,0,0,0
1525,96427259,weaknesses,some of the homework instructions where way to in depth to the point of it would take a solid 15 minutes to read the direction when i could be using that time to do the actual assignment.,0,0,0,0,0,0,0,0,0,0,0,0,0,0,0,0,0,0,0,0,0,0,0
1943,84984783,improved,Have the 4 year students be in small group more or have it be an online/module based and only be in when needed.,0,0,0,0,0,0,0,0,0,0,0,0,0,0,0,0,0,0,0,0,0,0,0
673,25422590,improved,More activities and in class practice.,0,0,0,0,0,0,0,0,0,0,0,0,0,0,0,0,0,0,0,0,0,0,0
804,95278400,strengths,Well organized and great instructions while also allowing the project to be open ended,0,0,0,0,0,0,0,0,0,0,0,0,0,0,0,0,0,0,0,0,0,0,0
1354,96005621,strengths,The class was very interactive. I enjoyed the hands on learning. I found visuals to be the most helpful.,0,0,0,0,0,0,0,0,0,0,0,0,0,0,0,0,0,0,0,0,0,0,0
1553,98938779,weaknesses,I wish that the design process showed up multiple times in the course (every time we discussed a certain component of it). I also wish we went a little deeper into figuring out how certain devices worked such as the multimeter.,0,0,0,0,0,0,0,0,0,0,0,0,0,0,0,0,0,0,0,0,0,0,0
1674,23713920,improved,More time on certain parts of the design project. More help on learning Arduino.,0,0,0,0,0,0,0,0,0,0,0,0,0,0,0,0,0,0,0,0,0,0,0
1693,67820429,improved,It could be improved by a more consistent grading scale.,0,0,0,0,0,0,0,0,0,0,0,0,0,0,0,0,0,0,0,0,0,0,0
1732,70034448,improved,I wish that the design process showed up multiple times in the course (every time we discussed a certain component of it). I also wish we went a little deeper into figuring out how certain devices worked such as the multimeter.,0,0,0,0,0,0,0,0,0,0,0,0,0,0,0,0,0,0,0,0,0,0,0
77,68642821,strengths,One of my strengths was getting more comfortable while talking in front of people. My favorite thing was talking about topics I liked talking about and was passionate about. Methods I found most helpful was the feedback from the professor.,0,0,0,0,0,0,0,0,0,0,0,0,0,0,0,0,0,0,0,0,0,0,0
794,62294704,strengths,This course has prepared me for the rest of my engineering career. It has been fun working in teams with people on different projects.,0,0,0,0,0,0,0,0,0,0,0,0,0,0,0,0,0,0,0,0,0,0,0
807,31220034,strengths,"I liked the explicit teaching of stuff like Excel, development roadmaps, and the sustainability stuff towards the end.",0,0,0,0,0,0,0,0,0,0,0,0,0,0,0,0,0,0,0,0,0,0,0
1041,91286563,weaknesses,I did think this course moved at a very slow pace. I think there is more that were able to be covered if the pace moved a little faster like nuclear energy maybe or talk more about some of the research you did about hydropower type stuff. Or maybe looking into ada's solar field and the wind turbines.,0,0,0,0,0,0,0,0,0,0,0,0,0,0,0,0,0,0,0,0,0,0,0
1080,34026771,improved,"Class time could be better used for developing our skills in something related to our design project (ie. lasercutting, machineshop, makerspace, CAD)",0,0,0,0,0,0,0,0,0,0,0,0,0,0,0,0,0,0,0,0,0,0,0
1465,51240642,strengths,"Overall the course was pretty good, I've never done a drop of programming and I feel like I have at least a pretty solid base in it now. Dr. knows it very well, and is a solid teacher and is enjoyable to be in class with.",0,0,0,0,0,0,0,0,0,0,0,0,0,0,0,0,0,0,0,0,0,0,0
340,47235415,strengths,The strengths of this course is that it is taught by an experienced professor who is an expert in the field of analysis.,0,0,0,0,0,0,0,0,0,0,0,0,0,0,0,0,0,0,0,0,0,0,0
4,82958722,strengths,"The strengths of this course are he explanation of assignments and the sample assignments. I enjoyed writing my research paper because it opened up a whole new controversial topic to me. The most effective methods of teaching are going through the rules for writers book and explaining how to do things the correct way. When writing the critical analysis essay, she walked us through the sample paper in 7h.",0,0,0,0,0,0,0,0,0,0,0,0,0,0,0,0,0,0,0,0,0,0,0
607,55941759,improved,Having more time allocated towards preparing and practicing giving speeches would greatly benefit us at the next conference.,0,0,0,0,0,0,0,0,0,0,0,0,0,0,0,0,0,0,0,0,0,0,0
722,81938191,strengths,Loved the fast paced aspect of the course and definitely learned a lot of material which was great!,0,0,0,0,0,0,0,0,0,0,0,0,0,0,0,0,0,0,0,0,0,0,0
1310,44849673,strengths,The information was well presented and the instructors flow in class was easy to follow.,0,0,0,0,0,0,0,0,0,0,0,0,0,0,0,0,0,0,0,0,0,0,0
1326,28500962,strengths,I thought the overall content and the organization of the course were very strong. I feel well prepared to handle basic tasks in my future classes. I also enjoyed having the very detailed schedule available on moodle to always have an idea of what was coming soon.,0,0,0,0,0,0,0,0,0,0,0,0,0,0,0,0,0,0,0,0,0,0,0
142,99547429,strengths,I think the strengths of this course was definitely her way of going about things stopping to make sure no one had any questions would help explain things in a different way if you didnÂ’t understand it in the first way. She worked very close with students and showed that she did care and would help you in any way needed.,0,0,0,0,0,0,0,0,0,0,0,0,0,0,0,0,0,0,0,0,0,0,0
1485,89508404,strengths,"Having a real client in Kenton OH is a really unique touch for the capstone experience. The ability to generate our own thoughts and ideas that have real impact has helped spark my motivation for the whole project. Our group has met with Kenton and been in communication with them several times, and it makes the whole experience a lot more worthwhile. I also believe the rubrics given for PRB 1 and 2 as well as the report templates were very effective, as they were the only consistent expectations and requirements given to all groups.",0,0,0,0,0,0,0,0,0,0,0,0,0,0,0,0,0,0,0,0,0,0,0
1510,71745895,weaknesses,"I felt at times there was too much going on without enough direction. Specifically with M1 and the week or two before Thanksgiving Break, there was a lot going on that at times was not fully explained in my opinion.",0,0,0,0,0,0,0,0,0,0,0,0,0,0,0,0,0,0,0,0,0,0,0
191,45899110,weaknesses,Amount of essays were overwhelming. As someone who struggles with writing the deep complex analysis required meant many of these assignments took north of 8 hours to complete. A substitutions of some essays for tests could provide a solution.,0,0,0,0,0,0,0,0,0,0,0,0,0,0,0,0,0,0,0,0,0,0,0
726,78522212,strengths,Professor did a good job of preparing us for this course by laying out what is to be expected and how fast the course goes. I think this course is beneficial in laying the foundation for future accounting classes and a career in accounting. I liked how we learned different platforms such as Excel and Quickbooks that are practical and how we actually got trained in them. I found that using class time to go over the things we struggled most in and having to come to class with the homework done was effective because it allowed us to get help over the things we actually needed help with. It was useful how everything was planned at the beginning of the semester and the Moodle was well structured so that we knew what was expected of us every class.,0,0,0,0,0,0,0,0,0,0,0,0,0,0,0,0,0,0,0,0,0,0,0
1028,28079097,weaknesses,"The lab memos were not really memos, they were more like reports. Most of the semester, we would have two weeks to do the reports but there were a couple weeks where they were due the next week which is a short time to write a full report.",0,0,0,0,0,0,0,0,0,0,0,0,0,0,0,0,0,0,0,0,0,0,0
1178,45579691,improved,"Provide a little more organization or structure to the class. I get that sometimes plans change and schedules have to adapt, but I think the course could have been a little more organized.",0,0,0,0,0,0,0,0,0,0,0,0,0,0,0,0,0,0,0,0,0,0,0
118,59607905,strengths,Dr. connected the concepts in the book to outside examples. Helped me meet new studentsÂ,0,0,0,0,0,0,0,0,0,0,0,0,0,0,0,0,0,0,0,0,0,0,0
1267,34793639,strengths,Expectations were clear from the start. It was organized and the syllabus kept us aligned.,0,0,0,0,0,0,0,0,0,0,0,0,0,0,0,0,0,0,0,0,0,0,0
1304,48680378,strengths,"Towards the end of the course, I feel better prepared for future projects, however, this was only accomplished through al trial and error, at the cost of my grade, rather than teaching. I enjoyed the interaction and in-class activities as opposed to a traditional lecture class.",0,0,0,0,0,0,0,0,0,0,0,0,0,0,0,0,0,0,0,0,0,0,0
1631,82158941,weaknesses,There were not very many opportunities for grades. I would have liked to have had more graded homework assignments.,0,0,0,0,0,0,0,0,0,0,0,0,0,0,0,0,0,0,0,0,0,0,0
1718,60096086,improved,This course could have less professional expectations as we are just learning to be professional.,0,0,0,0,0,0,0,0,0,0,0,0,0,0,0,0,0,0,0,0,0,0,0
1815,26264963,improved,"Having a Moodle page would be very helpful for students. Additionally, providing solutions for additional practice problems would be very beneficial to students. Overall, the course needs more structure.",0,0,0,0,0,0,0,0,0,0,0,0,0,0,0,0,0,0,0,0,0,0,0
252,38588083,weaknesses,Other classes only had to attend 3 concerts whereas we had to attend 5.,0,0,0,0,0,0,0,0,0,0,0,0,0,0,0,0,0,0,0,0,0,0,0
267,23299321,improved,This course could be improved by allowing for more time with conducting studies.,0,0,0,0,0,0,0,0,0,0,0,0,0,0,0,0,0,0,0,0,0,0,0
326,14440526,improved,During regular lectures provide the word and definition on the board so that we could write it down because his definition would be on the test and not the google definition.,0,0,0,0,0,0,0,0,0,0,0,0,0,0,0,0,0,0,0,0,0,0,0
42,34270726,strengths,Best thing about this course is the tutor Jarrod Jones. He helped me learn the material in an effective way,0,0,0,0,0,0,0,0,0,0,0,0,0,0,0,0,0,0,0,0,0,0,0
842,99102669,strengths,Enjoyed how you wrote out equations and how to solve them. One of the few classes i've actually been able to go back through my notes and understand them.,0,0,0,0,0,0,0,0,0,0,0,0,0,0,0,0,0,0,0,0,0,0,0
980,87301792,weaknesses,I feel that some of the ideas were rather hard to conceptualize and really understand what things were doing or meant when looking at the dynamic systems and controllers. I feel more visualization of the material in pictures and videos rather then just the math would greatly improve students understanding of what's actually going on while learning the math.,0,0,0,0,0,0,0,0,0,0,0,0,0,0,0,0,0,0,0,0,0,0,0
1168,61987735,improved,Nothing in particular.,0,0,0,0,0,0,0,0,0,0,0,0,0,0,0,0,0,0,0,0,0,0,0
1263,52084368,strengths,Very well organized course.,0,0,0,0,0,0,0,0,0,0,0,0,0,0,0,0,0,0,0,0,0,0,0
1361,60360238,strengths,I liked working with teams throughout the semester.,0,0,0,0,0,0,0,0,0,0,0,0,0,0,0,0,0,0,0,0,0,0,0
1399,99113163,strengths,"Being flexible with dates, which was really helpful with other classes.",0,0,0,0,0,0,0,0,0,0,0,0,0,0,0,0,0,0,0,0,0,0,0
1687,60350042,improved,Give more specifics about what will be on the cumulative exam.,0,0,0,0,0,0,0,0,0,0,0,0,0,0,0,0,0,0,0,0,0,0,0
1740,92499319,improved,All around a good class the material was presented good and was very able when I had to ask questions.,0,0,0,0,0,0,0,0,0,0,0,0,0,0,0,0,0,0,0,0,0,0,0
1951,25142336,instructor,I thought Dr. did a great job teaching and I really appreciated how prepared he was coming to class.,0,0,0,0,0,0,0,0,0,0,0,0,0,0,0,0,0,0,0,0,0,0,0
408,84363150,strengths,The openness of the lecture.,0,0,0,0,0,0,0,0,0,0,0,0,0,0,0,0,0,0,0,0,0,0,0
412,90750469,strengths,Dr. is very knowledgeable and is able to convey the information in the lectures very clearly.,0,0,0,0,0,0,0,0,0,0,0,0,0,0,0,0,0,0,0,0,0,0,0
463,36174671,strengths,The powerpoint slides made it very easy to follow a with and check back in on in case I missed something. Dr. is very passionate about the course and made it enjoyable to learn. I also appreciated having the opportunity for bonuses to boost my grade.,0,0,0,0,0,0,0,0,0,0,0,0,0,0,0,0,0,0,0,0,0,0,0
875,18194017,strengths,I enjoyed the labs and the diversity of the equipment we used. I also enjoyed the independence of the class and how we could use a lot of the equipment on our own.,0,0,0,0,0,0,0,0,0,0,0,0,0,0,0,0,0,0,0,0,0,0,0
1104,44353407,improved,"Due to learning by figuring things out, the CAD unit may be improved by giving CAD drawings of what we are to need to draw and not needing to watch a 10 minute video just to get specific dimensions.",0,0,0,0,0,0,0,0,0,0,0,0,0,0,0,0,0,0,0,0,0,0,0
1139,49102467,improved,Try making some of the instructions on the labs more clear and well explained so we know what all we need to keep track of for the labs.,0,0,0,0,0,0,0,0,0,0,0,0,0,0,0,0,0,0,0,0,0,0,0
31,74625167,improved,clear examples on what would be needed for each assignment and a developed explanation on MLA format on everything essay related because without a good explanation the student is left guessing on what exactly is needed of them.,0,0,0,0,0,0,0,0,0,0,0,0,0,0,0,0,0,0,0,0,0,0,0
812,47610481,strengths,"The strength of this course was getting to work what every project we wanted to within reason. This allowed me two learn more about the different aspects of different types of engineering. For example, I learned about coding and wiring a device when working on the main project.",0,0,0,0,0,0,0,0,0,0,0,0,0,0,0,0,0,0,0,0,0,0,0
1002,70927786,weaknesses,"The weaknesses of this course that some of the labs like the PLCs were difficult to understand and when starting them there wasn't much instruction on what to do, so the majority of the time doing the lab both during and outside of lab hours was trying to figure out what to do, but was eventually figured out through TA help.",0,0,0,0,0,0,0,0,0,0,0,0,0,0,0,0,0,0,0,0,0,0,0
1773,57757850,improved,"Less homework, more focus on labs.",0,0,0,0,0,0,0,0,0,0,0,0,0,0,0,0,0,0,0,0,0,0,0
1817,53358027,improved,I think if there was more structure in terms of having certain objectives to learn throughout the course it would overall be more organized and easier to follow and know what we were supposed to learn.,0,0,0,0,0,0,0,0,0,0,0,0,0,0,0,0,0,0,0,0,0,0,0
401,70610728,strengths,I enjoyed the feedback that Professor gave me for each of my presentations and referred back to her previous feedback to determine if we were improving. I liked that she cares about presentational speaking and makes it known.,0,0,0,0,0,0,0,0,0,0,0,0,0,0,0,0,0,0,0,0,0,0,0
476,13864874,strengths,I thought the subject matter was interesting. Dr. put in an effort to be engaging and ask questions to try and ascertain everyone's understanding.,0,0,0,0,0,0,0,0,0,0,0,0,0,0,0,0,0,0,0,0,0,0,0
6,40201721,strengths,"I loved how the research paper has the option of choosing your own topic. This overall made my learning more effective, and enjoyable.",0,0,0,0,0,0,0,0,0,0,0,0,0,0,0,0,0,0,0,0,0,0,0
690,99893960,improved,"any structure during the lecture. All structure was from the two textbooks, ones that were difficult to find at a reasonable price point at that.",0,0,0,0,0,0,0,0,0,0,0,0,0,0,0,0,0,0,0,0,0,0,0
1116,94044036,improved,I feel that some of the ideas were rather hard to conceptualize and really understand what things were doing or meant when looking at the dynamic systems and controllers. I feel more visualization of the material in pictures and videos or rather demonstration rather then just the math would greatly improve students understanding of what's actually going on while learning the math.,0,0,0,0,0,0,0,0,0,0,0,0,0,0,0,0,0,0,0,0,0,0,0
1156,86730093,improved,"Just ensure that the materials line up, and cover any reasonable assumptions necessary for the labs.",0,0,0,0,0,0,0,0,0,0,0,0,0,0,0,0,0,0,0,0,0,0,0
