row_id,pid,question,comment_clean,out_misrep,out_emo_lang,out_ideo_extrem,out_slip_slope,out_insult,out_mock_sarc,out_threat,pa_dress,pa_appear,pa_attit,pa_interact,pa_humor,pa_other,pb_sex,pb_lgbtq,pb_race,pb_origin,pb_nuero_div,pb_phys_able,pb_pol_affil,complex,constructive,reflective
810,79749329,strengths,I enjoyed group work with my group for the most part. Sometimes it got a bit frustrating dealing with people who do not contribute but overall it was a great experience for the future.,0,0,0,0,0,0,0,0,0,0,0,0,0,0,0,0,0,0,0,0,0,0,0
94,47903037,strengths,The reading responses were my strong suit.,0,0,0,0,0,0,0,0,0,0,0,0,0,0,0,0,0,0,0,0,0,0,0
1258,71551100,strengths,The workload was very manageable and the content was interesting and fit well into the course,0,0,0,0,0,0,0,0,0,0,0,0,0,0,0,0,0,0,0,0,0,0,0
1285,15800393,weaknesses,"I would like to see more points offered than just 100. If we make one small mistake, it could cost us an entire percentage point.",0,0,0,0,0,0,0,0,0,0,0,0,0,0,0,0,0,0,0,0,0,0,0
1396,47816510,strengths,"The instructor's style of lecturing was always effective. He was very good at getting points across quickly and simply without dragging or rambling most of the time. I really liked the setup with the reports as well how they increased in complexity each time. By the end, I actually feel like I can write a good report. I thought my forth report and the fifth one with my group were both very professionally and well written. Having a reference to look back at, even without being similar at in all in the actual experiments, it was well done to help learn how to do a report. I also thought a job was well done making us learn things on our own without totally leaving us hang out to dry. If I was completely stuck with something, he was willing to help out.",0,0,0,0,0,0,0,0,0,0,0,0,0,0,0,0,0,0,0,0,0,0,0
155,56166278,strengths,"I enjoyed this class very much! I've taken a music appreciation class before back in high school, but this class was so much better. The instructor did so well with explaining the material and also providing lots of examples. I genuinely looked forward to this class every time even though it was a gen-ed requirement for me. The instructor didn't use PowerPoint that much but still did a great job at explaining all the concepts in class. I loved his energy and thought he was an awesome professor. I thought everything that the professor did for this class was all good.",0,0,0,0,0,0,0,0,0,0,0,0,0,0,0,0,0,0,0,0,0,0,0
1765,93790000,improved,"There was talk of possibly increasing the amount of statistics taught in this class to remove the need to take the actual stats course, I would ally recommend not doing that because that would make it so there is just way too much going on in the class at one time. I also think it would have been better to try to start taking the data for projects earlier, or making one more intermediary step from data to final report. That would provide more of a cushion in case data needed to be recollected or the experiment needed to be changed, because data submission and then turning around and submitting two reports, Experiment 4 and Final Project, felt like a lot to do and was a bit hectic.",0,0,0,0,0,0,0,0,0,0,0,0,0,0,0,0,0,0,0,0,0,0,0
1955,23514407,instructor,Great job teaching us math:),0,0,0,0,0,0,0,0,0,0,0,0,0,0,0,0,0,0,0,0,0,0,0
229,33652642,weaknesses,I think the weakness of the course is that there was so much material to cover. I think choosing a couple of the areas we covered and going over that might be better. I didn't like that it didn't feel like there was much discussion. I didn't think that the teaching of the material was very effective or added much more to the learning of what we read.,0,0,0,0,0,0,0,0,0,0,0,0,0,0,0,0,0,0,0,0,0,0,0
314,81674972,improved,Maybe going through the posted example before the first paper would be helpful to give students a lead on how they should direct their ideas. Other than that did an awesome job this semester and had a blast during this course!!!,0,0,0,0,0,0,0,0,0,0,0,0,0,0,0,0,0,0,0,0,0,0,0
543,43127985,weaknesses,One thing that I struggled with for a while was the pace of the lectures. The professor talked very fast and you'd need to have more than a basic understanding of the topic beforehand to give productive contributions to the class. I eventually caught on and it worked out by the end,0,0,0,0,0,0,0,0,0,0,0,0,0,0,0,0,0,0,0,0,0,0,0
554,81424356,weaknesses,This course was not very organized and it was hard to stay engaged during lectures.,0,0,0,0,0,0,0,0,0,0,0,0,0,0,0,0,0,0,0,0,0,0,0
1117,51423860,improved,"Notes should be better organized, I prefer the guided notes over the power points.",0,0,0,0,0,0,0,0,0,0,0,0,0,0,0,0,0,0,0,0,0,0,0
1358,91860934,strengths,The course was very informative and helpful,0,0,0,0,0,0,0,0,0,0,0,0,0,0,0,0,0,0,0,0,0,0,0
1415,46674119,strengths,I enjoyed how Dr. understood how stressful classes can be. So I liked how he genuine cared about our well beings.,0,0,0,0,0,0,0,0,0,0,0,0,0,0,0,0,0,0,0,0,0,0,0
1496,59593166,weaknesses,Seemed like busy work at times,0,0,0,0,0,0,0,0,0,0,0,0,0,0,0,0,0,0,0,0,0,0,0
552,93730156,weaknesses,It's kind of hard to pay attention to the powerpoints when the class is over an hour . I would find myself daydreaming or not paying attention.,0,0,0,0,0,0,0,0,0,0,0,0,0,0,0,0,0,0,0,0,0,0,0
734,34425415,weaknesses,"The course moves very fast, at times the amount of work felt very unnecessary.",0,0,0,0,0,0,0,0,0,0,0,0,0,0,0,0,0,0,0,0,0,0,0
1066,17654923,improved,Lay out instructions more clearly for assignments.,0,0,0,0,0,0,0,0,0,0,0,0,0,0,0,0,0,0,0,0,0,0,0
1076,63099681,improved,Attempt to be more specific in lectures.,0,0,0,0,0,0,0,0,0,0,0,0,0,0,0,0,0,0,0,0,0,0,0
1185,16965073,improved,Make the project at the end more based on what we saw and learned while we were in Puerto Rico rather than the current format,0,0,0,0,0,0,0,0,0,0,0,0,0,0,0,0,0,0,0,0,0,0,0
1321,16394421,strengths,It challenged you to learn about engineering. I enjoyed the hand on homework 6 and learning how to 3d model.,0,0,0,0,0,0,0,0,0,0,0,0,0,0,0,0,0,0,0,0,0,0,0
1519,45632049,weaknesses,"The feedback given on projects and some assignments were very picky, and points were docked heavily for the smallest things which seemed like it was too much at times. Some of the TA's thought that certain aspects of a paper or projects were wrong when they really weren't.",0,0,0,0,0,0,0,0,0,0,0,0,0,0,0,0,0,0,0,0,0,1,0
1699,75828442,improved,I think explaining how to code a bit more would be beneficial.,0,0,0,0,0,0,0,0,0,0,0,0,0,0,0,0,0,0,0,0,0,0,0
1760,99619376,improved,Cut the workload down a good bit. We have way too much going on in other classes to stress about this 2 credit hour class. Also grade things faster.,0,0,0,0,0,0,0,0,0,0,0,0,0,0,0,0,0,0,0,0,0,0,0
1977,19361918,instructor,Keep doing what you are doing. Us students love you and you make us believe in ourselves as students and as people.,0,0,0,0,0,0,0,0,0,0,0,0,0,0,0,0,0,0,0,0,0,0,0
279,59564136,improved,Give students another opportunity to improve their grade instead of redoing their speech. I was actually kind of looking forward to the podcast.,0,0,0,0,0,0,0,0,0,0,0,0,0,0,0,0,0,0,0,0,0,0,0
470,94171023,strengths,Strengths are the PowerPoints and exams,0,0,0,0,0,0,0,0,0,0,0,0,0,0,0,0,0,0,0,0,0,0,0
556,57360667,weaknesses,"The slides were very useful and good material to take notes on, but if they were electronically available it would be much easier to annotate and listen in on your marks on it.",0,0,0,0,0,0,0,0,0,0,0,0,0,0,0,0,0,0,0,0,0,0,0
986,10047471,weaknesses,"the labs were a little to _figure it out yourself_ when it came to matlab and the PLC ladder logic concepts, the 2 page abstract seamed to not be much different from a full report but keep with it its a nice idea and i think it will keep going better as you use it and can know better what to tell people",0,0,0,0,0,0,0,0,0,0,0,0,0,0,0,0,0,0,0,0,0,0,0
1087,21944121,improved,More in class assignments,0,0,0,0,0,0,0,0,0,0,0,0,0,0,0,0,0,0,0,0,0,0,0
1109,66703950,improved,"I think it could be useful to provide more time in coming up with early ideas on the project. I felt like some of this was rushed, and once a team makes a decision on what kind of product they might design, there isn't much going back.",0,0,0,0,0,0,0,0,0,0,0,0,0,0,0,0,0,0,0,0,0,0,0
1453,14005762,strengths,The field trips and the labs I found to be enjoyable but Im not sure they really helped me understand the proccess. It was kinda more confusing as some parts of the plats) was different from what we studied,0,0,0,0,0,0,0,0,0,0,0,0,0,0,0,0,0,0,0,0,0,0,0
1911,23785396,weaknesses,Unknown aspect of what the course was intended to show and how we would be tested,0,0,0,0,0,0,0,0,0,0,0,0,0,0,0,0,0,0,0,0,0,0,0
526,58683116,weaknesses,"I feel as though only small portions of the textbook are required for reading, so purchasing the textbook seems excessive. I also feel as though the topics covered only in the textbook could be covered in class if Dr. sped up her lectures slightly (which I think is very possible).",0,0,0,0,0,0,0,0,0,0,0,0,0,0,0,0,0,0,0,0,0,0,0
561,23340882,weaknesses,"There were many times where what was talked about in class was not on the powerpoint. Then, we were expected to review the powerpoint to study for the quiz, midterm, and final, but it just ended up being more confusing this way.",0,0,0,0,0,0,0,0,0,0,0,0,0,0,0,0,0,0,0,0,0,0,0
714,46589694,improved,Improvements: incorporate more modern songs for some of the genres and a few more examples for some of the music genres or instrument sounds,0,0,0,0,0,0,0,0,0,0,0,0,0,0,0,0,0,0,0,0,0,0,0
1123,92134530,improved,"include a quick review of how to create different logic gates in ladder logic or some sort of way to help get our minds thinking in ladder logic, for matlab a quick reference sheet of common functions and there arguments could really help speed things up in lab and when doing hw, for the abstract including a fully done example may help with showing the line of how much to include",0,0,0,0,0,0,0,0,0,0,0,0,0,0,0,0,0,0,0,0,0,0,0
398,91321753,strengths,I really liked this class. I thought that the mini-examples of research experiments that we did in class and the examples you gave really helped to connect the material to everyday experience (deep processing ;)). I also felt like the actual labs helped to make connections with the materials.,0,0,0,0,0,0,0,0,0,0,0,0,0,0,0,0,0,0,0,0,0,0,0
641,26959670,improved,Perhaps offer that people with tablets or laptops that fold flat and can write on that they be allowed to use them if they keep them flat. This avoids them being distractions for those around them and keeps them in check that they're not going online because you can easily see if they're actually taking notes or not.,0,0,0,0,0,0,0,0,0,0,0,0,0,0,0,0,0,0,0,0,0,0,0
717,48687923,improved,"Make sure that there is enough discussion for both play and movie, and have it equal time for each play. Felt like we spent so much time on Richard III and barely discussed Romeo and Juliet.",0,0,0,0,0,0,0,0,0,0,0,0,0,0,0,0,0,0,0,0,0,0,0
1257,11774485,strengths,"I liked how when I walked into this class, I wasn't stressed out. It was a nice environment which was a change of pace.",0,0,0,0,0,0,0,0,0,0,0,0,0,0,0,0,0,0,0,0,0,0,0
1928,89651171,weaknesses,"Professor Bales was disorganized at times. The textbook chapters were not always available until a few hours before class, thus creating a challenge for completing the reading.",0,0,0,0,0,0,0,0,0,0,0,0,0,0,0,0,0,0,0,0,0,1,0
237,39251899,weaknesses,ally I found it hard to write notes because everything she said was aloud and I am ally a visual learner but she did draw out diagrams and things like that which was very helpful.,0,0,0,0,0,0,0,0,0,0,0,0,0,0,0,0,0,0,0,0,0,0,1
382,14852613,strengths,"I think the way the class was structured with non-mandatory attendance worked really well. I ally have a hard time paying attention in lectures a lot of the time so being able to use class time for how best suited my learning was great, plus I always had the option to come to lecture if I needed a little help on the topic. I think it the way the homework and quizzes were structured was also nice. Having all the homework due at the end of the chapter allowed me to be able to focus on other classes if I had a busy week with exams and just push back the homework to the weekend instead of juggling it and other classes throughout the week. The take home quizzes I found were a good test of my knowledge and to see what I really did and didn't know which helped me prep for the exam.",0,0,0,0,0,0,0,0,0,0,0,0,0,0,0,0,0,0,0,0,0,0,0
453,49460932,strengths,l enjoyed the content of this course.,0,0,0,0,0,0,0,0,0,0,0,0,0,0,0,0,0,0,0,0,0,0,0
110,45820146,strengths,The course material was very interesting.,0,0,0,0,0,0,0,0,0,0,0,0,0,0,0,0,0,0,0,0,0,0,0
1151,38236099,improved,possibly do quicker labs like the wind tunnel lab on all the equipment then give the student the option to chose a peace of equipment to do a more extensive lab with,0,0,0,0,0,0,0,0,0,0,0,0,0,0,0,0,0,0,0,0,0,0,0
1192,19318530,strengths,"A strength is that our expectations were definitely communicated in the beginning of rotations and throughout each month. I wasn't a fan of the negative manner in which this was frequently done (i.e. negative emails), but they were communicated.",0,0,0,0,1,0,0,0,0,1,0,0,0,0,0,0,0,0,0,0,0,0,0
521,87131446,weaknesses,It was sometimes a lot of homework that seemed like too much and the quizzes were very .,0,0,0,0,0,0,0,0,0,0,0,0,0,0,0,0,0,0,0,0,0,0,0
583,76831364,weaknesses,Sometimes it felt like there was too much assigned reading. I also was not a fan of the back-to-back essay and final exam as it was a little overwhelming.,0,0,0,0,0,0,0,0,0,0,0,0,0,0,0,0,0,0,0,0,0,0,0
946,20887125,weaknesses,Some due dates didn't make sense. The HW seemed like busy work.,0,0,0,0,0,0,0,0,0,0,0,0,0,0,0,0,0,0,0,0,0,0,0
1436,74496904,strengths,"A strength of this course is how well setup it is. You can tell that a lot of work was put into this course to ensure that it works properly and is able to give a good introduction of engineering to freshman students. Regarding Dr. , she was a wonderful professor and her major strength is her communication with students. You can tell that Dr. cares about her students and wants them to succeed through her feedback, willingness to answer questions, and willingness to have conversations about non-engineering topics with her students.",0,0,0,0,0,0,0,0,0,0,0,0,0,0,0,0,0,0,0,0,0,0,0
1642,62121113,weaknesses,"Students were given little help, or solutions for out of class examples.",0,0,0,0,0,0,0,0,0,0,0,0,0,0,0,0,0,0,0,0,0,0,0
349,31729565,strengths,"Doing drug cards every week for clinical really helped me in pharmacology. As much as I dreaded completing them, they helped me overall in my other courses. I did appreciate having the CTQ quizzes which we were able to be tested on new material but were also able to pick up easy points as a buffer in the course.",0,0,0,0,0,0,0,0,0,0,0,0,0,0,0,0,0,0,0,0,0,0,0
989,28769426,weaknesses,I felt that certain Matlab functions that would speed up the PID design process were not explained as thoroughly as they could've been.,0,0,0,0,0,0,0,0,0,0,0,0,0,0,0,0,0,0,0,0,0,0,0
1131,91983355,improved,You could talk more about how each unit relates to each other more to gain a better understanding of what is going on.,0,0,0,0,0,0,0,0,0,0,0,0,0,0,0,0,0,0,0,0,0,0,0
1232,32531584,improved,This was a wonderful course and I do not think that anything needs to be changed!,0,0,0,0,0,0,0,0,0,0,0,0,0,0,0,0,0,0,0,0,0,0,0
1279,51462879,weaknesses,I wish the course had more total points. I also found it very hard some days to pay attention in class and I felt like I was not getting the most out of this class.,0,0,0,0,0,0,0,0,0,0,0,0,0,0,0,0,0,0,0,0,0,0,0
1598,62902783,weaknesses,The course is a lot of work for a 2 credit hour class,0,0,0,0,0,0,0,0,0,0,0,0,0,0,0,0,0,0,0,0,0,0,0
1802,60031545,improved,I feel like more time being spent on how to use excel would've been useful.,0,0,0,0,0,0,0,0,0,0,0,0,0,0,0,0,0,0,0,0,0,0,0
247,97255696,weaknesses,I do not have any.,0,0,0,0,0,0,0,0,0,0,0,0,0,0,0,0,0,0,0,0,0,0,0
327,47290741,improved,I do not have any.,0,0,0,0,0,0,0,0,0,0,0,0,0,0,0,0,0,0,0,0,0,0,0
642,75801051,improved,"I like when we got to informal logic and would break up in groups to identify the strengths and weaknesses of the arguments and analogies. This really helped my understanding of it, and it would have been helpful to do this more.",0,0,0,0,0,0,0,0,0,0,0,0,0,0,0,0,0,0,0,0,0,0,0
1306,76890588,strengths,The course does a great job of taking us through the design process,0,0,0,0,0,0,0,0,0,0,0,0,0,0,0,0,0,0,0,0,0,0,0
1694,74895450,improved,"Besides giving slightly more direction in M1, I have no improvements to this course.",0,0,0,0,0,0,0,0,0,0,0,0,0,0,0,0,0,0,0,0,0,0,0
1824,18773536,improved,have more TAs available ti check off assignments,0,0,0,0,0,0,0,0,0,0,0,0,0,0,0,0,0,0,0,0,0,0,0
440,84195034,strengths,I liked the lectures and the PowerPoints,0,0,0,0,0,0,0,0,0,0,0,0,0,0,0,0,0,0,0,0,0,0,0
475,17979194,strengths,"This course went into great detail not just about gender in politics, but the role the LGBTQ+ community plays as well. The style of reading materials before class, and having a powerpoint lecture to guide notes was helpful. Additionally, there were many opportunities for discussion on course content both in and on Moodle forum posts, which allowed me to gain a deeper understanding of the material.",0,0,0,0,0,0,0,0,0,0,0,0,0,0,0,0,0,0,0,0,0,0,0
1043,76011293,weaknesses,"For the course, I wish there was more discussion and analysis of current trends in technology as opposed to studying more traditional sources of renewable energy. In terms of teaching it was very inconsistent across the board. During lectures, there are slides that may be very important but are glazed over very fast. Also with homework assignments, there are some problems that are graded for completion and some for accuracy. If the goal is to grade each problem for accuracy, make sure it happens.",0,0,0,0,0,0,0,0,0,0,0,0,0,0,0,0,0,0,0,0,0,0,0
1182,40871876,improved,"I'm not exactly sure how, but I feel like there could be some way to integrate the pre-class quiz material in a more engaging way than moodle quizzes.",0,0,0,0,0,0,0,0,0,0,0,0,0,0,0,0,0,0,0,0,0,0,0
1460,11356008,strengths,Lots of visual examples,0,0,0,0,0,0,0,0,0,0,0,0,0,0,0,0,0,0,0,0,0,0,0
1505,43118876,weaknesses,The cumulative exam was not a good measure of our knowledge. It took random information from random slides made throughout the semester.,0,0,0,0,0,0,0,0,0,0,0,0,0,0,0,0,0,0,0,0,0,0,0
1556,93152752,weaknesses,"I would say that one of the weaknesses of this course was the amount of work assigned, which can't really be helped. At times I felt like this course was the only one I was taking and seemed liked a full time job. Another aspect is some of the teaching was a little too broad; the arduino lab was not enough to be equipped with completing the M3c prototype.",0,0,0,0,0,0,0,0,0,0,0,0,0,0,0,0,0,0,0,0,0,0,0
1834,84612257,improved,A mid-term mandatory checkup on your understanding of the course material? You can meet with the professor and discuss what you aren't understanding yet about the material.,0,0,0,0,0,0,0,0,0,0,0,0,0,0,0,0,0,0,0,0,0,0,0
417,60112571,strengths,The teaching was fun and kept my attention. by just keeping things fun and making references to other things.,0,0,0,0,0,0,0,0,0,0,0,0,0,0,0,0,0,0,0,0,0,0,0
471,29600981,strengths,I enjoyed the amount of time spent on discussions of the course material.,0,0,0,0,0,0,0,0,0,0,0,0,0,0,0,0,0,0,0,0,0,0,0
1008,30647968,weaknesses,"A weakness of the course were the notes. The completed notes were hard to follow, so if you were lost on the homework or confused you couldn't really unconfuse yourself because the notes jumped everywhere. The notes were unorganized and were written with incomplete thoughts and sentences. Many times the work was not throughly worked through so numbers would just appear and the place they came from would be no where to be found.",0,0,0,0,0,0,0,0,0,0,0,0,0,0,0,0,0,0,0,0,0,0,0
1466,62668175,strengths,The modules were really helpful,0,0,0,0,0,0,0,0,0,0,0,0,0,0,0,0,0,0,0,0,0,0,0
1634,33494150,weaknesses,"Sometimes there was information not needed on the tests, which could be removed from the course material to allow for more time for practice problems. Also, I think that the practice problems we do should have the answer keys available online so we can verify that we are doing the processes correct instead of guessing. I think having quizzes would be useful also as this would allow the professor to check our progress with how we are doing on the practice problems. The professor also had handwriting that was difficult to read at some points, so either having typed notes that are projected on the board or slowing down to take the time to write a little neater would be useful so there is less confusion about what is being stated. There was also a point on the wastewater treatment cycle were we were given conflicting information, so verifying the information given is the correct one would be great so there is less room for confusion. Also, while the site visits were a good thing, I believe that being tested over them wasn't. It was hard to hear some of the people who were talking about the plant, especially if you were in the back of the group, and if they didn't go in the order of the plant, it was confusing. It was also hard to take notes on things since we had no idea what we would be tested over.",0,0,0,0,0,0,0,0,0,0,0,0,0,0,0,0,0,0,0,0,0,1,0
1910,92243091,weaknesses,Class discussion was more based on opinion than the actual law.,0,0,0,0,0,0,0,0,0,0,0,0,0,0,0,0,0,0,0,0,0,0,0
600,40678244,weaknesses,"There were not really any weaknesses of the course. However there were very few students enrolled the class, which made online discussion based assignments slightly difficult.",0,0,0,0,0,0,0,0,0,0,0,0,0,0,0,0,0,0,0,0,0,0,0
632,53075752,improved,"More clear expectations for the larger papers/assignments, more engaging classes, no virtual class held on a snow day",0,0,0,0,0,0,0,0,0,0,0,0,0,0,0,0,0,0,0,0,0,0,0
1234,36402459,strengths,"I enjoyed that it was online. It made it easy to get assignments done on my own time. When I wanted to take a break fro studying I could turn on one of the movies we had to watch so then it did not feel like I was wasting time while taking a break. I like that the movies were all relatable and very interesting. They are all movies I probably would have picked to watch at some point anyways. Overall, this was my favorite course this semester and I was upset when it was over.",0,0,0,0,0,0,0,0,0,0,0,0,0,0,0,0,0,0,0,0,0,0,0
134,75266754,strengths,students presentations were much more interesting,0,0,0,0,0,0,0,0,0,0,0,0,0,0,0,0,0,0,0,0,0,0,0
636,89134687,improved,More interactive activities.,0,0,0,0,0,0,0,0,0,0,0,0,0,0,0,0,0,0,0,0,0,0,0
720,55182943,improved,"There were some organizational issues with Moodle, but nothing was difficult to access overall.",0,0,0,0,0,0,0,0,0,0,0,0,0,0,0,0,0,0,0,0,0,0,0
1338,81877280,strengths,i loved the interaction we had with activities and group projects,0,0,0,0,0,0,0,0,0,0,0,0,0,0,0,0,0,0,0,0,0,0,0
1343,14374670,strengths,Allows for a lot of creativity and develops engineering skills,0,0,0,0,0,0,0,0,0,0,0,0,0,0,0,0,0,0,0,0,0,0,0
1495,47416867,weaknesses,wasnt focused on a specific engineering discipline which made it feel like it was for exploratory,0,0,0,0,0,0,0,0,0,0,0,0,0,0,0,0,0,0,0,0,0,0,0
1857,42868114,instructor,I really enjoyed how you set the class up and presented information. I also really enjoyed your weekly emails and felt that these really helped to keep me accountable,0,0,0,0,0,0,0,0,0,0,0,0,0,0,0,0,0,0,0,0,0,0,0
324,44516777,improved,"Just give us a different professor. Dr. was not the original professor we signed up for, and I have a good feeling that if we would have had the chance to choose between him and anyone else we would have gone with the other .",0,0,0,0,1,0,0,0,0,0,0,0,0,0,0,0,0,0,0,0,0,0,0
90,47722930,strengths,Topics explained clearly,0,0,0,0,0,0,0,0,0,0,0,0,0,0,0,0,0,0,0,0,0,0,0
1114,89270901,improved,I thought this course ran very well and not sure that I have any suggestions for improvements.,0,0,0,0,0,0,0,0,0,0,0,0,0,0,0,0,0,0,0,0,0,0,0
1216,49541422,weaknesses,There could have been more resources to learn about the ethical principles that were being discusses.,0,0,0,0,0,0,0,0,0,0,0,0,0,0,0,0,0,0,0,0,0,0,0
1600,44588961,weaknesses,No comments. This course was great!,0,0,0,0,0,0,0,0,0,0,0,0,0,0,0,0,0,0,0,0,0,0,0
174,56592650,weaknesses,A ton of hours were spent on this class. It feels like it should be more than a four-credit hour class.,0,0,0,0,0,0,0,0,0,0,0,0,0,0,0,0,0,0,0,0,0,0,0
1775,87264825,improved,No comments. This course was great!,0,0,0,0,0,0,0,0,0,0,0,0,0,0,0,0,0,0,0,0,0,0,0
693,77042548,improved,"I liked the content of this course, however I feel the material could've been delivered better. Through maybe more in class discussions, less online assignments to worry about to avoid stress and assignment dread/over load, more visual content. For example I really enjoyed the pre-class post on our perception of certain images and then discussing it further in class.",0,0,0,0,0,0,0,0,0,0,0,0,0,0,0,0,0,0,0,0,0,0,0
138,66037917,strengths,I liked the discussion posts for each class.,0,0,0,0,0,0,0,0,0,0,0,0,0,0,0,0,0,0,0,0,0,0,0
1609,36986009,weaknesses,I did not need a course on study habits and panels of past students talking.,0,0,0,0,0,0,0,0,0,0,0,0,0,0,0,0,0,0,0,0,0,0,0
1736,24872230,improved,"Again , overall a very well done course.Â",0,0,0,0,0,0,0,0,0,0,0,0,0,0,0,0,0,0,0,0,0,0,0
