row_id,pid,question,comment_clean,out_misrep,out_emo_lang,out_ideo_extrem,out_slip_slope,out_insult,out_mock_sarc,out_threat,pa_dress,pa_appear,pa_attit,pa_interact,pa_humor,pa_other,pb_sex,pb_lgbtq,pb_race,pb_origin,pb_nuero_div,pb_phys_able,pb_pol_affil,complex,constructive,reflective
1014,26897187,weaknesses,Labs kind of sucked. The PLC labs and those guys coming in to talk about controllers were pretty cool.,0,0,0,0,0,0,0,0,0,0,0,0,0,0,0,0,0,0,0,0,0,0,0
1645,92350914,weaknesses,"Everything about the class was a weakness. The class is set up like garbage. The teaching of the material sucks. They do not want us to succeed. And then at the end of the semester only a handful of people are passing the class, so it obviously must be the students fault. I mean it could never be the fault of the makers of the class, right?. Which is completely wrong. and set this class up for you to fail or get a very bad grade. They do not want you to succeed in this class. And if that isn't the case, then why does everyone say that about this class? If the class is not flawed, then why does everyone dislike it and do poorly in it? I mean come on, it does not take a rocket scientist to realize that this class is set up for failure.",1,0,0,0,1,1,0,0,0,0,0,0,0,0,0,0,0,0,0,0,0,0,0
1743,57088410,improved,"why is this a 2-credit hour course.... we meet for the same amount of time a week that a 3-credit hour class does. I end up putting in more hours a week on a stupid 2 credit hour class than I do a 3 credit hour. the work load is too much. why are we doing reports, exams, and a fat group project. dum",0,0,0,0,1,0,0,0,0,0,0,0,0,0,0,0,0,0,0,0,0,0,0
1594,42663180,weaknesses,Sarcastic comments/feedback served only to make the student feel stupid and was not productive or helpful.,0,0,0,0,0,0,0,0,0,0,0,0,0,0,0,0,0,0,0,0,0,1,0
557,14391955,weaknesses,"It only being offered as a once per week 3 hour class was quite annoying to me. I would have preferred it to meet twice a week. Often, we strayed away from the course material and talked about other topics such as gun control. When this occurred, I often felt targeted as everyone in the class and Dr. would contribute to how the thought people who support gun rights were _stupid individuals_ for believing what they do. Lastly, all of the course material was taught through a power point. A single power point, that is 300+ slides packed with information.",0,0,0,0,0,0,0,0,0,0,0,0,0,0,0,0,0,0,0,0,1,1,0
488,93372762,weaknesses,I HATED the blanks it is the worst thing known to man. As someone who solely focused on filling the blanks I consistently missed what she was lecturing about. IT WAS THE BIGGEST WASTE OF MY TIME. It takes away from learning _to make students pay attention._ How can we pay attention if we are solely focused on filling in the blanks come on Dr. use some common sense.,0,1,0,0,1,1,0,0,0,0,0,0,1,0,0,0,0,0,0,0,0,0,0
616,91242231,improved,"Get rid of Dr. . She is so disrespectful to todays patients it is sad. She even brought in her husband to show how much of a rude judgmental she is. All he talked about is how much he loves to judge patients and not actually help them remedy their pain. She showed her true colors this semester aside her husband, she is a terrible representation to professional nurses everywhere. She does not care about seeing students succeed it is almost like it is her duty to try and make students fail.",1,1,0,0,1,0,0,0,0,1,0,0,0,0,0,0,0,0,0,0,1,1,0
1831,52924429,improved,i feel the nacb project is a half assed take on what we did in FOD 1 and 2 and doesn't hold much value in the class especially going back to Arduino for the project when we've been using matlab all year in addition it doesn't corelate with anything else in that class and seems like busy work that's already been done in the last two semesters if there was to be a way to improve it i think you should change it to a group coding on matlab so it stays within the class materials we use and still keeps the group aspect.,0,0,0,0,0,0,0,0,0,0,0,0,0,0,0,0,0,0,0,0,1,1,0
575,89227475,weaknesses,The only weakness of this course is that you must be self driven and stay on top of the reading for the course. It would be easy to feign reading the article and still participate to some degree in the cl**** though it would be just setting yourself up for failure. * Inappropriate words were found and removed from this response.,0,0,0,0,0,0,0,0,0,0,0,0,0,0,0,0,0,0,0,0,0,0,0
559,22383186,weaknesses,The course is taught by a fossil with extremely dated views that he loves to insert into every conversation in this course. The lectures could put someone on coke to sleep and the videos we watch are worse.,0,0,0,0,1,1,0,0,0,1,0,0,0,0,0,0,0,0,0,0,0,0,0
613,79460950,improved,GIT RID OF THE BLANKS. Also don't take over a month to grade our papers next time. We know you are busy but delegate your work if you are overwhelmed so are the students. The paper doesn't facilitate any new learnings anyways.,0,1,0,0,0,0,0,0,0,0,0,0,0,0,0,0,0,0,0,0,0,1,0
1660,61276469,weaknesses,"At the same time, I'm really bad at getting help with stuff I'm stuck on and would definitely bang my head against the wall for more than I had to sometimes.",0,0,0,0,0,0,0,0,0,0,0,0,0,0,0,0,0,0,0,0,0,0,1
1889,97928851,weaknesses,"The book was horrible, online textbook is not the way to go.",0,0,0,0,0,0,0,0,0,0,0,0,0,0,0,0,0,0,0,0,0,0,0
397,26923255,strengths,I really enjoyed the labs in this cl**** they helped me understand concepts a lot better. * Inappropriate words were found and removed from this response.,0,0,0,0,0,0,0,0,0,0,0,0,0,0,0,0,0,0,0,0,0,0,0
189,91409260,weaknesses,boring material,0,0,0,0,0,0,0,0,0,0,0,0,0,0,0,0,0,0,0,0,0,0,0
491,44661528,weaknesses,"ATI how is that fair you don't teach us about it all semester and them make it an exam grade. Absolutely terrible teaching. I don't get how she is the director of nursing she is mean, judgmental, and temperamental. She is old and out of touch with current nursing practices. maybe she should go back to the bedside to learn something because she has not taught us anything helpful.",0,0,0,0,1,0,0,0,0,1,0,0,0,0,0,0,0,0,0,0,0,0,0
244,45842904,weaknesses,Prof is kinda annoying,0,0,0,0,1,0,0,0,0,1,0,0,0,0,0,0,0,0,0,0,0,0,0
1867,23917396,strengths,professor Baez made a somewhat dry subject fun; never made anyone feel as if they dumb for not knowing answers asked of them in class; liked how open discussions always were,0,0,0,0,0,0,0,0,0,0,0,0,0,0,0,0,0,0,0,0,0,0,0
567,27263276,weaknesses,"There are many weaknesses to this course. This was the first time this course was offered. There was not complete syllabus until the end of February. The assignments were ridiculous at times, and it seemed that we were just doing Dr. 's dirty work for the Ray Brown project. He did not go a good job of explaining what his grading criteria were for the group project.",0,0,0,0,0,0,0,0,0,0,0,0,0,0,0,0,0,0,0,0,0,1,0
1573,13524941,weaknesses,The sarcastic and sometimes rude comments on reports with little helpful info. The fact that it seems as if you are being judged every time you make a mistake. Lectures were like a boring lullaby that makes you wanna sleep as soon as you sit down.,0,0,0,0,1,0,0,0,0,1,0,0,0,0,0,0,0,0,0,0,0,0,0
1478,34845625,strengths,"The independence given to you at the beginning of the semester is good since you are not overloaded, but also a curse because you forget how much you still have to complete for tier 1.",0,0,0,0,0,0,0,0,0,0,0,0,0,0,0,0,0,0,0,0,0,0,0
147,18351058,strengths,I loved how Dr. would use a lot of diverse music in his examples. I had a great time listening to it. I would always text my mom or dad when a song that we knew was played. I honestly was not expecting to like this course at all but it was a lot of fun. Normally Gen Eds like #10 for Diversity we have to do just suck and we don't really learn anything useful but this one was awesome and I feel like I actually can appreciate and talk about music with other people now. I liked that we get to present our own music and our take on it. I always got a good laugh out of the people who went up and played a song and obviously had not been paying attention in class because they had no idea what they were talking about. (It was always the people who brought the country songs too) :D I listen to a lot of music and this class has made me aware of what I like and dislike in a song and given me the ability to actually express that using words. I can also more effectively search up music that I might like and try out new things too.,0,0,0,0,0,0,0,0,0,0,0,0,0,0,0,0,0,0,0,0,0,0,0
513,97175407,weaknesses,Material was repetitive and boring,0,0,0,0,0,0,0,0,0,0,0,0,0,0,0,0,0,0,0,0,0,0,0
1475,10234646,strengths,dr. is a very nice guy and he's passionate about this course he tried to light a fire under everyone's *** when the class was behind in work and i feel he did it in a good way not getting agitated or mad just making sure we knew as a class where we were at. i liked the figure it out by yourself element of the class as i think i work better with hands on items * Inappropriate words were found and removed from this response.,0,0,0,0,0,0,0,0,0,0,0,0,0,0,0,0,0,0,0,0,0,0,0
460,93079676,strengths,"This class had no strengths, it was not enjoyable, and his teaching methods were very poor.",0,0,0,0,0,0,0,0,0,0,0,0,0,0,0,0,0,0,0,0,0,0,0
681,76487302,improved,"There are too many things that could be improved. Send Dr. to Shady Side Retirement Home or Vancrest because he's starting to sundown real bad. He needs a full time nurse, a drool bib, and a bedpan. I cannot stress this enough but he is incredibly out of touch with reality and the current sociopolitical environment today. He constantly compares Trump to Hitler after discussing Reductio ad Hitlerum which basically means if anyone compares anything to Hitler in an argument they have lost the argument and their point is moot. I don't care what my professors political views are but I do care when they are constantly inserted into the class throughout the semester when it is not a class about politics. Dr. is the definition of a professor that tries to aggressively push their ideologies on students when it is not appropriate or welcome. His lectures are a complete snooze fest as noted earlier. He rambles on for hours and does absolutely nothing to engage the students. The videos we watched in class were just as boring that essentially substituted for nap time because some people would fall asleep during this class. I could have done an 8 ball of coke before class and still fell asleep because of how monotonous and tone deaf this hack was. He was by far the worst professor I have ever taken a course with in my time at ONU. Please send him to Vancrest so he can interact with people around his age with similarly degrading mental faculties.",0,0,1,0,1,1,0,0,0,1,0,0,0,0,0,0,0,0,0,1,0,0,0
1610,29602826,weaknesses,It was not worth any credit so it felt pointless.,0,0,0,0,0,0,0,0,0,0,0,0,0,0,0,0,0,0,0,0,0,0,0
243,38536378,weaknesses,"What wasnt a weakness of this course... The room in inaccessible, the only way you can get there is by going up 3 flights of stairs. He refused to make the room accessible, and would not work with me on my accommodations until multiple people got involved (Heather Nash, Melissa Verb, Lynda Nyce) On the first day let us know that he didn't care enough to learn out names, multiple times in the course he would make racist or otherwise inappropriate jokes. He graded kids badly if they chose _Boring song_. Often making fun of students if he found the song they presented on as boring. He was terrible at teaching the material, it was almost impossible to keep awake. Almost every single student had their phone or laptop out and was working on other assignments, or even playing chess. Once a student gave their presentation he would grill them, asking them questions that had nothing to do with the assignment. Even during our final presentations he said after 7 minutes of questioning a student _okay I guess Ill be done grilling you_. He is unprofessional, uneducated, mean, racist, sexist, ableists and classist. At one point he told a student (whose English is their second language) that they needed to speak more clearly or be docked points. This same student in another class was terrified to give a presentation after being told this by Dr. . He told this same student that their opinion on Japanese music (his country of origination) was wrong.",0,0,0,0,1,0,0,0,0,1,0,0,0,0,0,0,0,0,0,0,1,1,0
1795,46952948,improved,I think that a little less homework or a bit er deadlines would help. Also assigning each a section of the project and get indivually graded off that so that others don't have to do extra work just because someone is being lazy.,0,0,0,0,0,0,0,0,0,0,0,0,0,0,0,0,0,0,0,0,0,1,0
1056,23906852,improved,No homework. Or make the homework less tedious and annoying to do.,0,0,0,0,0,0,0,0,0,0,0,0,0,0,0,0,0,0,0,0,0,0,0
1506,38543056,weaknesses,The class was a pileup of work which seemed unimportant and annoying.,0,0,0,0,0,0,0,0,0,0,0,0,0,0,0,0,0,0,0,0,0,0,0
624,80133812,improved,Talk ahead not behindÂ,0,0,0,0,0,0,0,0,0,0,0,0,0,0,0,0,0,0,0,0,0,0,0
406,59971446,strengths,"I did not enjoy this class, I find it a waste of time.",0,0,0,0,0,0,0,0,0,0,0,0,0,0,0,0,0,0,0,0,0,0,0
969,92850804,weaknesses,The boring and hard to understand PowerPoints,0,0,0,0,0,0,0,0,0,0,0,0,0,0,0,0,0,0,0,0,0,0,0
485,25787662,weaknesses,The course content was the weakness. The course content was little bit boring.Â,0,0,0,0,0,0,0,0,0,0,0,0,0,0,0,0,0,0,0,0,0,0,0
429,84030222,strengths,The topic is good. Everything else about this course is a dumpster fire.,0,1,0,0,1,0,0,0,0,0,0,0,0,0,0,0,0,0,0,0,0,0,0
32,14134802,improved,The feedback from other classmates in feedback activities was pointless and a waste of time in my opinion. Because I felt like I was giving great feedback but my partner would give a _good job_ or something unhelpful.,0,0,0,0,0,0,0,0,0,0,0,0,0,0,0,0,0,0,0,0,0,0,0
179,72533355,weaknesses,Graded too hard for an entry level speech class.Â,0,0,0,0,0,0,0,0,0,0,0,0,0,0,0,0,0,0,0,0,0,0,0
231,74333450,weaknesses,"classes were extremely and boring. he talked to himself and his own opinions for the entirety of class. he talked about topics in the book, but they were not helpful in further assignments or anything else. not sure what the point of his discussions were, since they were not useful and were not a summary. reading class material and attending class felt like a waste of time to hear his opinions and not have him look for participation. if a student did participate, they were dismissed if they did not share the same views. reading Appiah over and over was repetitive and eventually dull. assigning the same prompt for papers was lazy and confusing. there was no point in reading anything since he did not engage with students in class. I'm never sure what he wanted or what I was doing wrong, and did not learn anything from his assignments. having moodle assignments everyday was confusing because of incorrect dates and his lack of response all semester to our work. we did not spend even amounts of time on subjects which contributed to a struggle in understanding rushed topics later on. he chose not to explain what he wanted for the project and displays none of those characteristics in his own presenting, yet was harsh on students' creativity in presenting",0,0,0,0,0,0,0,0,0,0,0,0,0,0,0,0,0,0,0,0,1,1,0
1821,88907268,improved,"The class NEEDS to be restructured. Throw away the whole set up and set up. The videos for class are little to no help. When you ask for help after trying for hours, y'all say to basically go away and struggle. This class makes everyone very heated. Also your 3.9 GPA is meaning less to us, because I am sure that where you went for college, you actually learned the material. I had a 3.8 at a college prep high school. You know why? Because they actually taught us and cared about us and weren't a bunch of jerks. This school in general really sucks at taking care of their students. They take your money and run. I am a customer, I am paying you to give me a quality education. Like do y'all not know how business works? Do not get me wrong, I like a challenge and want to be challenged. I can take a challenge. But when we do not get taught the proper material needed, then we cannot succeed. I was challenged at my college prep school, but I was able to succeed because they taught the material. Crazy how that works. I was able to get a 3.8 gpa at my college prep high school. Yeah we can brag about our high gpa too. May not be a 3.9, but I don't need to brag about my previous gpa like you did in class. Because no one else really cares except for yourself. Y'all need to be more like DR. Johnstone. He is a challenging professor, however, he actually cares and want you to succeed. Thank you for coming to my TED Talk.",0,0,0,0,1,1,0,0,0,1,0,0,0,0,0,0,0,0,0,0,0,0,0
1597,23857367,weaknesses,"I ended up with a really poor project group. One member did absolutely nothing, and the other two's work wasn't really that good. we had really bad communication, which I didn't try to help, which only made our ability to complete the assignments really bad.",0,0,0,0,0,0,0,0,0,0,0,0,0,0,0,0,0,0,0,0,0,0,1
514,28383354,weaknesses,Talk. Talk. Talk. Just sit in class for 50 minutes and listen to the prof talk. Extremely boring.,0,0,0,0,0,0,0,0,0,0,0,0,0,0,0,0,0,0,0,0,0,0,0
1235,63073105,strengths,"I loved paddleton, brain on fire, to the bone, and the theory of everything",0,0,0,0,0,0,0,0,0,0,0,0,0,0,0,0,0,0,0,0,0,0,0
1564,97046826,weaknesses,teacher grades assignments 1 month after submission. wack,0,0,0,0,0,0,0,0,0,0,0,0,0,0,0,0,0,0,0,0,0,0,0
915,53995894,weaknesses,Some activities feel pointless or have very little instructions,0,0,0,0,0,0,0,0,0,0,0,0,0,0,0,0,0,0,0,0,0,0,0
609,14044849,improved,More yelling!,0,0,0,0,0,0,0,0,0,0,0,0,0,0,0,0,0,0,0,0,0,0,0
480,44201856,weaknesses,Would've been helpful if less time was spent discussing nazis and other random stuff with no relevance and more time actually spent on better constructing Senior Thesis.,0,0,0,0,0,0,0,0,0,0,0,0,0,0,0,0,0,0,0,0,0,1,0
1130,80828475,improved,"I do also wish that with the guided notes you provided a printout of them for days that you planned on using them. It would always slip my mind to go and print them out and then I was kind of screwed for class, same thing with the log paper, it just makes it easier to take good notes. or at least have us fill out a survey maybe for if we want printed notes or not and then only bring so many copies to classtime cause I know a lot of people do have ipads. I know you are always wanting to help but sometimes it feels like a burden to you to go ask questions just because you seem really stressed all of the time always busy. I know you don't actually mean to appear that way but that is always how it makes me feel and does sometimes make me hesitant to visit your office for smaller scale questions. But this is where I enjoy the TA office hours because jake does a really good job with these types of questions.",0,0,0,0,0,0,0,0,0,0,0,0,0,0,0,0,0,0,0,0,1,1,0
538,98750671,weaknesses,"This course is a waste of time. It is not a review of a portfolio. Technical students do not have a portfolio. If they are going to go into an interview, they are going to have a resume with a list of relevant experience, not a portfolio. If the interviewer asks about a specific production that was worked on, then the interviewee should have enough knowledge from their experience working on said production to answer any question that come up. If the interviewer asks to see pictures of the production, then the interviewee should have some on hand, but having a portfolio is not an essential part of this course.",0,0,0,0,0,0,0,0,0,0,0,0,0,0,0,0,0,0,0,0,1,1,0
1035,88265995,weaknesses,I found the class kind of boring as all of the labs were not that fun.,0,0,0,0,0,0,0,0,0,0,0,0,0,0,0,0,0,0,0,0,0,0,0
910,53968964,weaknesses,"Some of the things we were required to do for the design reviews seemed repetitive. I also wish we had more time to come up with our design idea. Most of the TAs were good, especially Jess, but there was one (I think it was Megan but I'm not certain) who was unhelpful.",0,0,0,0,0,0,0,0,0,0,0,0,0,0,0,0,0,0,0,0,0,0,0
1727,69550424,improved,maybe be a little slower and have better in class instructions,0,0,0,0,0,0,0,0,0,0,0,0,0,0,0,0,0,0,0,0,0,0,0
1833,23156857,improved,"Make due dates or more strict deadlines for some big parts of tier one so all of the projects and quizzes after tier one do not have to be rushed through. Side note: Dr. Lawrence is not an _*******_, just brutally honest to students who have not put in a passing-grade effort. * Inappropriate words were found and removed from this response.",0,0,0,0,0,0,0,0,0,0,0,0,0,0,0,0,0,0,0,0,0,0,0
527,92335550,weaknesses,"The professor. Seems she enjoys preaching information, but not actually TEACHING students. Seems to passive aggressively pick on students, making small comments here and there, and having favorites to cold call in class. Constructive criticisms were more criticism than constructive, especially on lab days. Overall vibe that the professor does not enjoy being around students but she overcompensates with her tone and behavior - very _Nice Mean Girl_ -esque behavior. Made the class difficult for me, as I was constantly bothered by her general demeanor and way of speaking to students. She also seemed a bit bothered by any questions regarding the content, which made me not want to clarify any confusion I had.",1,0,0,0,1,0,0,0,0,1,0,0,0,0,0,0,0,0,0,0,0,0,0
520,88603377,weaknesses,"At times, the material was boring. I know that is just how logic class can be sometimes, but the activities we did, I didn't feel like they always helped my knowledge of the subject and seemed like a waste of time.",0,0,0,0,0,0,0,0,0,0,0,0,0,0,0,0,0,0,0,0,0,0,0
1287,95973528,weaknesses,"law is just boring, not much you can do to help that not nit picking some details in quizzes; feels like 3 questions were easy, but 1-2 were supposed to be tricks regularly",0,0,0,0,0,0,0,0,0,0,0,0,0,0,0,0,0,0,0,0,0,0,0
1647,71394827,weaknesses,Its easy to get behind,0,0,0,0,0,0,0,0,0,0,0,0,0,0,0,0,0,0,0,0,0,0,0
515,68085382,weaknesses,I am not a fan of ethics so it was pretty boring.,0,0,0,0,0,0,0,0,0,0,0,0,0,0,0,0,0,0,0,0,0,0,0
1592,58114811,weaknesses,"Timely feedback, I understand the instructor is busy. However, it might be easier for you to require less work out of the students if you know it will be taxing on them (it is only a 2 hr course after all) AND that you won't be able to give feedback in a timely manner. Not trying to be rude, just logical.",0,0,0,0,0,0,0,0,0,0,0,0,0,0,0,0,0,0,0,0,0,1,0
1604,91999636,weaknesses,Felt like the course was somewhat pointless. Didn't get as much out of the course as I thought.,0,0,0,0,0,0,0,0,0,0,0,0,0,0,0,0,0,0,0,0,0,0,0
297,53984998,improved,scones everyday,0,0,0,0,0,0,0,0,0,0,0,0,0,0,0,0,0,0,0,0,0,0,0
537,48910827,weaknesses,"The communication is terrible. When not accessible to ask questions to the individual who will be grading and who is organizing this, it is very difficult to ask questions and get specific information, especially when not on campus. There were often times when things were left open ended and I had to ask for things multiple times to be sent to me to be sent over. I understand that this individual has other things going on, but after several weeks of waiting, I would have expected a response or at least something saying that I am getting to it.",0,0,0,0,0,0,0,0,0,0,0,0,0,0,0,0,0,0,0,0,1,1,0
1823,30852954,improved,have the teacher teach more instead of trying to teach us through videos,0,0,0,0,0,0,0,0,0,0,0,0,0,0,0,0,0,0,0,0,0,0,0
1920,28234953,weaknesses,no hard copy text other than FRCP itself and online book which was terrible...and more than half of it was password protected by Harvard making it inaccessible to us.,0,0,0,0,0,0,0,0,0,0,0,0,0,0,0,0,0,0,0,0,0,1,0
1949,62336435,improved,Do small room class every day,0,0,0,0,0,0,0,0,0,0,0,0,0,0,0,0,0,0,0,0,0,0,0
550,73059301,weaknesses,"There were times that I felt that I was doing well on something in the class and when the playing test came around, I was only left feeling defeated and shot down like all of my efforts meant nothing and I actually did horrible. There were times that I would dedicate a lot of time to learning each instrument and really showing what I know but the grading was so specific and hard! I felt that if we are suppose to be at the 5th grade level, why was the grading so tough? I would have liked to be given the opportunity to show improvement and growth be a focus for grading instead of focusing on how perfect we had to be!",0,0,0,0,0,0,0,0,0,0,0,0,0,0,0,0,0,0,0,0,0,0,0
1120,82940520,improved,"Overall, this was a well ran course by a good professor the only thing that I would suggest is either find a new approach with office hours or adjust the current method so that it is more clear that your are just trying to get us to think more about our question and not that your being condescending.",0,0,0,0,0,0,0,0,0,0,0,0,0,0,0,0,0,0,0,0,0,0,0
913,84712707,weaknesses,If you have a bad group you are stuck with them the entire semester.,0,0,0,0,0,0,0,0,0,0,0,0,0,0,0,0,0,0,0,0,0,0,0
1107,37500655,improved,"Every assignment has more words than necessary, which created confusion regarding the assignment. I heard many classmates express similar frustration this same frustration.Â",0,0,0,0,0,0,0,0,0,0,0,0,0,0,0,0,0,0,0,0,0,0,0
219,49869954,weaknesses,I ally did not like and of the readings in the textbook. I thought they were and boring. I feel that learned more from the books and articles we read than the textbook chapters.,0,0,0,0,0,0,0,0,0,0,0,0,0,0,0,0,0,0,0,0,0,0,0
