"row_id","pid","question","comment_clean","out_misrep","out_emo_lang","out_ideo_extrem","out_slip_slope","out_insult","out_mock_sarc","out_threat","pa_dress","pa_appear","pa_attit","pa_interact","pa_humor","pa_other","pb_sex","pb_lgbtq","pb_race","pb_origin","pb_nuero_div","pb_phys_able","pb_pol_affil","complex","constructive","reflective","total_toxicity","TOXICITY","SEVERE_TOXICITY","INSULT","TOXICITY2"
55,80445860,"improved","This class could be improved by Professor retiring and getting a new professor.",0,0,0,0,1,0.5,0,0,0,0,0,0,0,0,0,0,0,0,0,0,0,0,0,1.5,0.01218908,0.0006914139,0.0076268767,0.0128804939
243,38536378,"weaknesses","What wasnt a weakness of this course... The room in inaccessible, the only way you can get there is by going up 3 flights of stairs. He refused to make the room accessible, and would not work with me on my accommodations until multiple people got involved (Heather Nash, Melissa Verb, Lynda Nyce) On the first day let us know that he didn't care enough to learn out names, multiple times in the course he would make racist or otherwise inappropriate jokes. He graded kids badly if they chose _Boring song_. Often making fun of students if he found the song they presented on as boring. He was terrible at teaching the material, it was almost impossible to keep awake. Almost every single student had their phone or laptop out and was working on other assignments, or even playing chess. Once a student gave their presentation he would grill them, asking them questions that had nothing to do with the assignment. Even during our final presentations he said after 7 minutes of questioning a student _okay I guess Ill be done grilling you_. He is unprofessional, uneducated, mean, racist, sexist, ableists and classist. At one point he told a student (whose English is their second language) that they needed to speak more clearly or be docked points. This same student in another class was terrified to give a presentation after being told this by Dr. . He told this same student that their opinion on Japanese music (his country of origination) was wrong.",0,0,0,0,1,0,0,0,0,1,0,0,0,0,0,0,0,0,0,0,1,1,0,2,0.19599396,0.0044822693,0.10148193,0.2004762293
244,45842904,"weaknesses","Prof is kinda annoying",0,0,0,0,1,0,0,0,0,1,0,0,0,0,0,0,0,0,0,0,0,0,0,2,0.29405528,0.005378723,0.24928534,0.299434003
315,16705344,"improved","the assignments are set up to be discussed, so the class should be set up in groups for discussion about certain topics to come to the conclusions he wants rather than being lectured on. he needs to keep his opinions to himself and let students discuss to learn. change the paper topic every time and discuss in class after grading what you're looking for. teach topics/ points you want included in papers in class rather than talking about supporting examples and not connecting them. connect to modern day topics, not old history or religion that is difficult for students to connect to. this class is well set up, but should be taught by a different professor",0,0,0,0,0,0,0,0,0,0,0,0,0,0,0,0,0,0,0,0.25,0,0,0,0.25,0.02638162,0.00093460083,0.0142009165,0.02731622083
324,44516777,"improved","Just give us a different professor. Dr. was not the original professor we signed up for, and I have a good feeling that if we would have had the chance to choose between him and anyone else we would have gone with the other .",0,0,0,0,1,0,0,0,0,0,0,0,0,0,0,0,0,0,0,0,0,0,0,1,0.015393426,0.00057697296,0.009127886,0.01597039896
336,62363827,"improved","Add in a few more experimental teaching methods and pull back on the less professional conduct (Although I do think it is fine in mediation)",0,0,0,0,0.5,0,0,0,0,0.5,0,0,0,0,0,0,0,0,0,0,0,0,0,1,0.027913637,0.0009584427,0.013212911,0.0288720797
352,41234822,"strengths","It was good if you had a hx of healthcare experience it was impossible for someone without it tho. It should be more ample to share learning outcomes since it does not facilitate at all about thinking like a nurse. The professor just keeps saying that but does not show or explain how and then with the exams that's all there was to it.",0.5,0,0,0,0,0,0,0,0,0,0,0,0,0,0,0,0,0,0,0,0,0,0,0.5,0.01419965,0.00064373016,0.009374888,0.01484338016
429,84030222,"strengths","The topic is good. Everything else about this course is a dumpster fire.",0,0.5,0,0,1,0,0,0,0,0,0,0,0,0,0,0,0,0,0,0,0,0,0,1.5,0.16331999,0.0033187866,0.06494803,0.1666387766
437,93412740,"strengths","The only strength of the course was going to a Toledo Mudhens game.",0,0,0,0,0.5,0,0,0,0,0,0,0,0,0,0,0,0,0,0,0,0,0,0,0.5,0.013257195,0.0007915497,0.007873878,0.0140487447
488,93372762,"weaknesses","I HATED the blanks it is the worst thing known to man. As someone who solely focused on filling the blanks I consistently missed what she was lecturing about. IT WAS THE BIGGEST WASTE OF MY TIME. It takes away from learning _to make students pay attention._ How can we pay attention if we are solely focused on filling in the blanks come on Dr. use some common sense.",0.5,1,0,0,1,1,0,0,0,0,0,0,0.5,0,0,0,0,0,0,0,0,0,0,4,0.3969567,0.019998873,0.24171697,0.416955573
491,44661528,"weaknesses","ATI how is that fair you don't teach us about it all semester and them make it an exam grade. Absolutely terrible teaching. I don't get how she is the director of nursing she is mean, judgmental, and temperamental. She is old and out of touch with current nursing practices. maybe she should go back to the bedside to learn something because she has not taught us anything helpful.",0,0,0,0,1,0,0,0,0,1,0,0,0.5,0,0,0,0,0,0,0,0,0,0,2.5,0.29771072,0.0044822693,0.2735258,0.3021929893
500,90801622,"weaknesses","The teacher just lectured the entire time about the homework we completed prior to class, it became very repetitive and monotonousÂ",0,0,0,0,0.5,0,0,0,0,0.5,0,0,0,0,0,0,0,0,0,0,0,0,0,1,0.056016337,0.0012111664,0.027605021,0.0572275034
514,28383354,"weaknesses","Talk. Talk. Talk. Just sit in class for 50 minutes and listen to the prof talk. Extremely boring.",0,0,0,0,0.5,0,0,0,0,0.5,0,0,0,0,0,0,0,0,0,0,0,0,0,1,0.147767,0.0016498566,0.06442356,0.1494168566
527,92335550,"weaknesses","The professor. Seems she enjoys preaching information, but not actually TEACHING students. Seems to passive aggressively pick on students, making small comments here and there, and having favorites to cold call in class. Constructive criticisms were more criticism than constructive, especially on lab days. Overall vibe that the professor does not enjoy being around students but she overcompensates with her tone and behavior - very _Nice Mean Girl_ -esque behavior. Made the class difficult for me, as I was constantly bothered by her general demeanor and way of speaking to students. She also seemed a bit bothered by any questions regarding the content, which made me not want to clarify any confusion I had.",0.5,0,0,0,1,0,0,0,0,1,0,0,0,0,0,0,0,0,0,0,0,0,0,2.5,0.112333365,0.0022792816,0.06302499,0.1146126466
528,95942012,"weaknesses","Labs were awkward at the beginning of the semester because you don't always know the people you're working with and it sometimes felt like you could never get the right answer that Dr. wanted you to. I did not like how grades were not posted to Moodle, it made it difficult to figure out where you stood in the class and how you were doing.",0,0,0,0,0.5,0,0,0,0,0,0.5,0,0,0,0,0,0,0,0,0,0,0,0,1,0.039226998,0.0009870529,0.018838953,0.0402140509
559,22383186,"weaknesses","The course is taught by a fossil with extremely dated views that he loves to insert into every conversation in this course. The lectures could put someone on coke to sleep and the videos we watch are worse.",0,0,0,0,1,1,0,0,0,0.5,0,0,0,0,0,0,0,0,0,0,0,0,0,2.5,0.3389984,0.008773804,0.34135336,0.347772204
566,29276608,"weaknesses","The course did not have a syllabus until after a few weeks and the writing assignments were graded at a grad school level. Additionally, there were no rubrics for any of the assignments and there were no guidelines to follow. It doesn't seem fair to grade harshly when there are no specific requirements. If you're going to give out a project with no details, no rubric, and no idea where you want us to go with it, respond to our emails and don't take a week off right before it's due. And if you're gonna do all that, don't take a dump all over the report we put together.",0,0,0,0,0,1,0,0,0,0,0,0,0,0,0,0,0,0,0,0,0,1,0,1,0.032627538,0.0010156631,0.017807651,0.0336432011
569,37575788,"weaknesses","Everything else. It was incredibly disorganized, and expectations were difficult to ascertain. We spent way too much time on some topics and only a couple classes on others that are arguably more applicable to the course. The tests were impossible to complete, as the amount of material per exam was overwhelming even for the most knowledgeable student in the class.",1,0,0,0,0,0,0,0,0,0,0,0,0,0,0,0,0,0,0,0,0,0,0,1,0.022846194,0.0007343292,0.013402912,0.0235805232
585,20707542,"weaknesses","The class moves incredibly slowly, we were supposed to be covering information about the post WWII era at this point in the semester and instead we have not even touched the 20th century. Dr. also tends to wander. He cannot stay on topic and instead of teaching about, for example, the French Revolution, he will wander so far off topic to discuss his ideas on modern political, social, and societal issues like the covid-19 pandemic. I am not saying this because I disagree with his views, in fact, more often than not I agree with what he says, but I did not register for a class on my teacher's opinions. I did not get what I was told I was going to get out of this class, I found it to be insulting to the student body and a complete waste of my time, I would dread going to this class because I know that each day would be so slow and I would learn nothing of importance. I learned more from the few tutoring sessions with Noah Shaw that I attended than I did in the entire semester of Western Civ 2 that I attended.",1,0,0,0,0,0,0,0,0,0,0,0,0,0,0,0,0,0,0,0,0.5,1,0,1,0.050821137,0.0014019012,0.025284592,0.0522230382
613,79460950,"improved","GIT RID OF THE BLANKS. Also don't take over a month to grade our papers next time. We know you are busy but delegate your work if you are overwhelmed so are the students. The paper doesn't facilitate any new learnings anyways.",0.5,0.5,0,0,0,0,0,0,0,0,0,0,0,0,0,0,0,0,0,0,0,1,0,1,0.3308965,0.019611536,0.16195811,0.350508036
616,91242231,"improved","Get rid of Dr. . She is so disrespectful to todays patients it is sad. She even brought in her husband to show how much of a rude judgmental she is. All he talked about is how much he loves to judge patients and not actually help them remedy their pain. She showed her true colors this semester aside her husband, she is a terrible representation to professional nurses everywhere. She does not care about seeing students succeed it is almost like it is her duty to try and make students fail.",1,0.5,0,0,1,0,0,0,0,1,0,0,0,0,0,0,0,0,0,0,0.5,0.5,0,3.5,0.39231625,0.014769804,0.42881694,0.407086054
659,24484518,"improved","If you want to improve interview skills, bring in local business people with experience in the arts that people do not know, as if we are meeting them for the first time and have them grade us. It is very difficult to take this course seriously when it is a group of professors that we have known for possibly 3+ years. The best way to get better at being in an interview is by being in more interviews, so subject people to ACTUAL interviews instead of these mock interviews with professors. It just makes it seem that much more _fake_. If it seemed like it were a real interview with someone outside of the university, or someone outside of the department, it would make this process much more realistic. Interview skills can make or break a job, but this course does not help interview skills, it is simply a joke that we are required to do to achieve an _S_ so that we can graduate.",0,0,0,0,1,0,0,0,0,0,0,0,0,0,0,0,0,0,0,0,0.5,1,0,1,0.067380086,0.0012302399,0.032248367,0.0686103259
662,21560671,"improved","I think giving a bit more guidance to students when looking for answers during lectures would be helpful rather than what often comes off as a sort of rejection.",0,0,0,0,1,0,0,0,0,1,0,0,0,0,0,0,0,0,0,0,0,0,0,2,0.013634177,0.0005030632,0.008519882,0.0141372402
681,76487302,"improved","There are too many things that could be improved. Send Dr. to Shady Side Retirement Home or Vancrest because he's starting to sundown real bad. He needs a full time nurse, a drool bib, and a bedpan. I cannot stress this enough but he is incredibly out of touch with reality and the current sociopolitical environment today. He constantly compares Trump to Hitler after discussing Reductio ad Hitlerum which basically means if anyone compares anything to Hitler in an argument they have lost the argument and their point is moot. I don't care what my professors political views are but I do care when they are constantly inserted into the class throughout the semester when it is not a class about politics. Dr. is the definition of a professor that tries to aggressively push their ideologies on students when it is not appropriate or welcome. His lectures are a complete snooze fest as noted earlier. He rambles on for hours and does absolutely nothing to engage the students. The videos we watched in class were just as boring that essentially substituted for nap time because some people would fall asleep during this class. I could have done an 8 ball of coke before class and still fell asleep because of how monotonous and tone deaf this hack was. He was by far the worst professor I have ever taken a course with in my time at ONU. Please send him to Vancrest so he can interact with people around his age with similarly degrading mental faculties.",0,0,0.5,0,1,1,0,0,0,1,0,0,0,0,0,0,0,0,0,0.75,0,0,0,4.25,0.19870108,0.004463196,0.13245803,0.203164276
687,98429007,"improved","Maybe grade at a reasonable level.",0,0,0,0,0,1,0,0,0,0,0,0,0,0,0,0,0,0,0,0,0,0,0,1,0.07608539,0.0013160706,0.030154925,0.0774014606
983,60604548,"weaknesses","The course was well taught a with the lab and some topics that were unclear in lecture were sometimes clarified in lab. The only downside to this class is Dr.s office hours can often times be counter productive because his approach with answering questions with a question often times come off as condescending. This often times lead to even more confusion and less likelihood of going back to office hours for help.",0,0,0,0,1,0,0,0,0,0,1,0,0,0,0,0,0,0,0,0,0,0,0,2,0.014576632,0.0005173683,0.010058892,0.0150940003
1098,19972438,"improved","this could be improved by having less busy homework designed to waste my time when I could be doing something more valuable.",1,0,0,0,0,0,0,0,0,0,0,0,0,0,0,0,0,0,0,0,0,0,0,1,0.04216247,0.0007677078,0.018129934,0.0429301778
1120,82940520,"improved","Overall, this was a well ran course by a good professor the only thing that I would suggest is either find a new approach with office hours or adjust the current method so that it is more clear that your are just trying to get us to think more about our question and not that your being condescending.",0,0,0,0,0.5,0,0,0,0,0.5,0,0,0,0,0,0,0,0,0,0,0,0,0,1,0.103060275,0.0010490417,0.056719027,0.1041093167
1121,27176269,"improved","There are many opinions on your approachability. You theorize that it's because you're _big, loud, and passionate,_ but I don't think this is necessarily the reason. I don't have this problem, but I have noticed that your responses to questions are often sarcastic or quick to point out something wrong. While this is helpful that you recognize issues quickly, It comes off with a tone of disappointment or annoyance. There are also many times when I have come to your office and you seem annoyed that I want to talk about something or ask a question. I think this apparent disinterest in problems is where people find it difficult to talk to you.",0,0,0,0,1,0,0,0,0,1,0,0,0,0,0,0,0,0,0,0,0,0.5,0,2,0.08004235,0.0014781952,0.034672357,0.0815205452
1130,80828475,"improved","I do also wish that with the guided notes you provided a printout of them for days that you planned on using them. It would always slip my mind to go and print them out and then I was kind of screwed for class, same thing with the log paper, it just makes it easier to take good notes. or at least have us fill out a survey maybe for if we want printed notes or not and then only bring so many copies to classtime cause I know a lot of people do have ipads. I know you are always wanting to help but sometimes it feels like a burden to you to go ask questions just because you seem really stressed all of the time always busy. I know you don't actually mean to appear that way but that is always how it makes me feel and does sometimes make me hesitant to visit your office for smaller scale questions. But this is where I enjoy the TA office hours because jake does a really good job with these types of questions.",0,0,0,0,0.5,0,0,0,0,0.5,0,0,0,0,0,0,0,0,0,0,0.5,1,0,1,0.11652588,0.004673004,0.034782536,0.121198884
1167,68218569,"improved","The homework for this class took forever. Some sections more than others. Felt at times like this course took er to complete than my core classes.",0.5,0,0,0,0,0,0,0,0,0,0,0,0,0,0,0,0,0,0,0,0,0,0,0.5,0.0126288915,0.00072956085,0.007778878,0.01335845235
1192,19318530,"strengths","A strength is that our expectations were definitely communicated in the beginning of rotations and throughout each month. I wasn't a fan of the negative manner in which this was frequently done (i.e. negative emails), but they were communicated.",0,0,0,0,1,0,0,0,0,1,0,0,0,0,0,0,0,0,0,0,0,0,0,2,0.015896067,0.0006914139,0.009355888,0.0165874809
1203,68389891,"weaknesses","The disrespectful and/or passive aggressive emails. There will be times when I used appropriate/respectful language but felt most of the emails back from Dr. was a bit aggressive and should be a bit more professional- sending reply emails to clarification questions in all caps or making sound like a command instead of a respectful answer to a question we are confused about. Also, some of the messages through CORE sent to the APPE students was a little discouraging. Sometimes we may not be doing good in our drug knowledge due to stress or other life factors we are trying to figure out. From talking to some friends, a good majority of us are truly trying and working hard but still collectively get put down in emails for our faults.",0,0,0,0,1,0,0,0,0,0,1,0,0,0,0,0,0,0,0,0,0.5,1,0,2,0.09308127,0.0016593933,0.035333443,0.0947406633
1206,65378588,"weaknesses","I think Pat could be a better to work with. I think she could think through some of what she says for APPE prep in and in emails better. For example in class, we were told if we needed to live in our cars for rotations we would have to, pat offers no sympathy or care for students, making most students not want to talk with her to bring up issues and honestly bitter and dreading appes. I myself had issue that was ignored for weeks and when I got help eventually, I left her office crying. Additionally emails do not make sense that she writes, maybe rereading them would help them sound more professional, which preaches to usÂ… I also heard from a preceptor about an email she sent about professionalism to preceptors that I believe puts ONU students in a negative light. ItÂ’s unfortunate that pat is one of the last professors we have experience with, because she very negatively impacts views of ONU of not only future alumni but also preceptors.Â",0,0,0,0,0.5,0,0,0,0,0.5,0,0,0,0,0,0,0,0,0,0,0.5,0.5,0,1,0.083999306,0.0015640259,0.042665333,0.0855633319
1212,86112572,"weaknesses","In class lectures during P5 year that related to APPEs were mostly dreaded by students it seems. We appreciated the insight and the explanations of how things would work during APPEs, but we were treated like children most of the time. I think the experiential office needs to have more faith in the professionalism that was taught to us starting P1 year, and trust us to act appropriately since we are all adults. It was frustrating going to class just to be yelled at and sort of threatened for how we may or may not act in our future APPEs. One five or ten minute speech on that would have sufficed, but it was every single time we were all in that room together. It can make students feel like their university has no trust or faith in their abilities.",0,0,0,0,0.5,0,0,0,0,0.5,0,0,0,0,0,0,0,0,0,0,0,0,0,1,0.050821137,0.001373291,0.025800243,0.052194428
1223,43058794,"improved","Maybe just have sympathy.Â",0,0,0,0,0.5,0.5,0,0,0,0.5,0,0,0,0,0,0,0,0,0,0,0,0,0,1.5,0.07608539,0.002040863,0.028942931,0.078126253
1549,54689742,"weaknesses","Intentionally confusing",1,0,0,0,0,0,0,0,0,0,0,0,0,0,0,0,0,0,0,0,0,0,0,1,0.03781283,0.0012969971,0.01625293,0.0391098271
1560,80839473,"weaknesses","Honestly, I thought the class was well taught and conducted however when giving feedback on reports please try and write a little neater lol it took me so on some reports to try and decipher what your notes said. Other than that this was a good class. Andy",0,0,0,0,0.5,0,0,0,0,0,0,0,0,0,0,0,0,0,0,0,0,1,0,0.5,0.050078966,0.0014877319,0.022706337,0.0515666979
1571,25273179,"weaknesses","TIME. Project. Taking forever to get grades back. The project was too open-ended and seemed very rushed at the end. Starting earlier with a more refined focus would help immensely. But the main problem is that this 2 credit lab took more of my time than multiple three credit classes. It is actually absurd. Between the homework and report and the project, it is a lot and it is not spread evenly.",0.5,0,0,0,0,0,0,0,0,0,0,0,0,0,0,0,0,0,0,0,0,0,0,0.5,0.08083374,0.0014305115,0.033019636,0.0822642515
1573,13524941,"weaknesses","The sarcastic and sometimes rude comments on reports with little helpful info. The fact that it seems as if you are being judged every time you make a mistake. Lectures were like a boring lullaby that makes you wanna sleep as soon as you sit down.",0.5,0,0,0,1,0.5,0,0,0,0.5,0.5,0,0,0,0,0,0,0,0,0,0,0,0,3,0.26104406,0.0032234192,0.23704576,0.2642674792
1575,73338128,"weaknesses","The course had way to many projects and experiments than a two credit hour course should have. These reports were tens of pages with tables and graphs and equations that required a lot of time spent on them if a good grade was desired. The feedback on submitted work also took forever to receive back. Feedback is really important in learning and correcting mistakes so when feedback isn't received until finals week, it is kind of pointless at that point. The powerpoints could definitely be a little better as far as the presentation of them and the delivery of them.",0.5,0,0,0,0,0,0,0,0,0,0,0,0,0,0,0,0,0,0,0,0,1,0,0.5,0.03969839,0.0010728836,0.021803947,0.0407712736
1594,42663180,"weaknesses","Sarcastic comments/feedback served only to make the student feel stupid and was not productive or helpful.",0,0,0,0,0.5,0,0,0,0,0,0.5,0,0,0,0,0,0,0,0,0,0,0.5,0,1,0.4838166,0.01121521,0.5145894,0.49503181
1645,92350914,"weaknesses","Everything about the class was a weakness. The class is set up like garbage. The teaching of the material sucks. They do not want us to succeed. And then at the end of the semester only a handful of people are passing the class, so it obviously must be the students fault. I mean it could never be the fault of the makers of the class, right?. Which is completely wrong. and set this class up for you to fail or get a very bad grade. They do not want you to succeed in this class. And if that isn't the case, then why does everyone say that about this class? If the class is not flawed, then why does everyone dislike it and do poorly in it? I mean come on, it does not take a rocket scientist to realize that this class is set up for failure.",1,0,0,0,1,1,0,0,0,0,0,0,0,0,0,0,0,0,0,0,0,0,0,3,0.5140397,0.08595808,0.48569724,0.59999778
1722,25238121,"improved","This course could be improved by giving less busy work, that ultimately has nothing to do with our group projects or assignments. Also, I feel as if we should get more days in class to work on our projects, instead of just doing very random tasks all the time. It would be helpful, especially to student athletes and those with busy schedules, who have limited time to meet (and when they do it's late at night).",0.5,0,0,0,0,0,0,0,0,0,0,0,0,0,0,0,0,0,0,0,0,0,0,0.5,0.0069113337,0.00042915344,0.0066388706,0.00734048714
1731,46078736,"improved","My suggestion would be to try and get more knowledgeable TAs (and also TAs that are actually nice). Some of the TAs were really great, kind, and helpful like Jess, but others like the two TAs on Sunday were not. The TAs on Sundays never had any idea how to answer questions, and they never wanted to look up the answers either. They just didn't want to be bothered with any of us who needed help, and it clearly showed in their attitudes.",1,0,0,0,1,0.5,0,0,0,1,0,0,0,0,0,0,0,0,0,0,0,0,0,3.5,0.030388435,0.00064849854,0.018645585,0.03103693354
1743,57088410,"improved","why is this a 2-credit hour course.... we meet for the same amount of time a week that a 3-credit hour class does. I end up putting in more hours a week on a stupid 2 credit hour class than I do a 3 credit hour. the work load is too much. why are we doing reports, exams, and a fat group project. dum",0,0,0,0,0.5,0,0,0,0,0,0,0,0,0,0,0,0,0,0,0,0,0,0,0.5,0.50759226,0.01806218,0.5130944,0.52565444
